task_uid,is_live_benchmark,task_complexity,query,query_char_length,query_word_count,query_question_marks,query_digit_count,query_uppercase_words,num_available_tools,tool_names,total_params,total_required_params,num_string_params,num_numeric_params,num_boolean_params,num_array_params,num_object_params,num_enum_params,has_default_values,avg_param_description_length,tool_description_total_length,task_domain,can_answer
task_00001,1,low,air,3,1,0,0,0,1,ThinQ_Connect,1,1,0,0,0,0,1,0,0,81.0,132,other,0
task_00002,1,low,what is your name?,18,4,1,0,0,1,get_current_weather,2,1,2,0,0,0,0,1,1,77.5,122,travel,0
task_00003,1,low,Could you give me Python code that get 2 int type parameters and add them,73,14,0,1,0,1,get_current_weather,2,1,2,0,0,0,0,1,1,116.0,72,travel,0
task_00004,0,high,Find me the most recent art sculpture by James Plensa with detailed description.,80,13,0,0,0,4,get_zodiac_compatibility|local_nursery.find|get_sculpture_info|monarch.getMonarchOfYear,10,7,6,1,2,1,0,1,1,46.9,282,other,1
task_00005,0,medium,"""Can you help me find a recipe that uses chicken as the main ingredient and doesn't require more than 5 ingredients? After that, could you also find a restaurant that serves Italian cuisine and falls within a mid-range price? And finally, could you find another recipe that uses beef as the main ingredient and requires no more than 7 ingredients?""",348,58,3,2,0,2,restaurant.find|recipe.find,4,3,2,1,0,1,0,0,0,51.75,176,other,1
task_00006,1,low,start Docker on window using docker start.,42,7,0,0,0,1,cmd_controller.execute,1,1,1,0,0,0,0,0,0,212.0,194,other,1
task_00007,1,medium,"FMP's Income Statement API provides access to real-time income statement data for a wide range of companies, including public companies, private companies, and ETFs. This data can be used to track a company's profitability over time, to compare a company to its competitors, and to identify trends in a company's business.",322,51,0,0,2,1,requests.get,3,2,2,0,0,0,1,0,1,132.33,278,other,0
task_00008,0,low,"What is the current time in Sydney, Australia?",46,8,1,0,0,1,get_local_time,3,1,3,0,0,0,0,1,1,67.67,44,other,0
task_00009,1,high,"I'm looking to visit a park in Toronto that's suitable for children. Find one for me, and I don't mind if there's an entry fee.",127,25,0,0,0,5,Flights_4_SearchOnewayFlight|Flights_4_SearchRoundtripFlights|Hotels_2_BookHouse|Hotels_2_SearchHouse|Travel_1_FindAttractions,25,11,21,4,0,0,0,9,1,83.32,602,travel,1
task_00010,1,high,provide me version information,30,4,0,0,0,5,version_api.VersionApi.get_version|project_api.ProjectApi.get_project_by_name_and_version|project_api.update_project|badge_api.BadgeApi.get_project_vulnerabilities_badge|repository_api.update_repository,8,8,6,0,0,0,2,0,0,61.0,442,nlp,1
task_00011,0,medium,"In game Battle Reign, change the armor level to 5 and find me a game guide for how to win in snowy weather conditions. Also find me any strategy guides available for game Shadow Fall.",183,34,0,1,0,2,BattleReignGameAPI.update_player_equipment|GameGuideAPI.search_guide,6,3,4,2,0,0,0,0,1,41.67,124,travel,1
task_00012,1,medium,I have a query: 'what is the weather like'. Could you classify it appropriately?,80,14,1,0,0,1,record,6,6,0,0,0,6,0,0,0,90.0,181,travel,1
task_00013,1,medium,"I'm trying to log into my account, but I can't remember if I have 'remember me' enabled. My password is 'correcthorsebatterystaple'.",132,21,0,0,0,1,user_authentication.login,4,2,2,1,1,0,0,0,1,43.75,119,other,0
task_00014,1,high,I need Kubernetes events from 193000 to 339000. Make sure to filter for only updates.,85,13,0,12,0,3,events_api.EventsApi.kubernetes_info_events|events_api.EventsApi.get_events|agent_monitoring_events,18,3,1,9,8,0,0,1,1,130.56,655,other,1
task_00015,1,high,Can you help me to locate something interesting to do?,54,10,1,0,0,8,Buses_3_FindBus|Buses_3_BuyBusTicket|Events_3_FindEvents|Events_3_BuyEventTickets|Flights_4_SearchOnewayFlight|Flights_4_SearchRoundtripFlights|Hotels_4_ReserveHotel|Hotels_4_SearchHotel,40,25,31,7,2,0,0,10,1,71.47,1006,travel,0
task_00016,1,medium,,1,0,0,0,0,2,get_current_weather|web_search,6,2,4,1,1,0,0,2,1,68.67,133,travel,0
task_00017,1,medium,"What are the synthetic locations, give me 5?",44,7,1,1,0,3,SyntheticSettingsApi.get_synthetic_location|get_synthetic_locations|SyntheticSettingsApi.get_synthetic_tests,7,4,5,2,0,0,0,1,1,89.0,282,other,1
task_00018,1,high,Could you locate any theater events in New York on the 12th of March?,69,14,1,2,0,8,Buses_3_FindBus|Buses_3_BuyBusTicket|Events_3_FindEvents|Events_3_BuyEventTickets|Flights_4_SearchOnewayFlight|Flights_4_SearchRoundtripFlights|Hotels_4_ReserveHotel|Hotels_4_SearchHotel,40,25,31,7,2,0,0,10,1,72.6,1006,travel,1
task_00019,0,medium,"Book a room for 2 adults and a child at the Sheraton Hotel in New York with check-in on May 1, 2022 and check-out on May 5, 2022. Also, Book a room for 1 adult and 2 children at the Marriott in Los Angeles with check-in on June 1, 2022 and check-out on June 10, 2022.",267,45,0,24,0,1,hotel_booking.book,6,6,4,2,0,0,0,0,0,36.83,92,travel,1
task_00020,0,medium,What's the area of a circle with a radius of 10?,48,10,1,2,0,2,geometry.area_circle|plot_sine_wave,7,4,1,6,0,0,0,0,1,39.14,104,other,1
task_00021,1,low,Help find a housekeeper who provides ironing services.,54,8,0,0,0,1,get_service_id,2,1,0,2,0,0,0,1,1,114.5,97,other,1
task_00022,1,high,Book me a ticket from USA NYC to India New Delhi using api tools and respond in json,84,18,0,0,2,6,generate_image_tool|tts_tool|write_markdown_tool|write_html_tool|search_web_tool|get_url_content,15,7,13,2,0,0,0,2,1,98.8,1271,vision,0
task_00023,0,low,Get me the details of the last game played by Liverpool F.C. Include its statistics.,84,16,0,0,0,1,soccer.get_last_match,2,1,1,0,1,0,0,0,0,58.5,73,other,1
task_00024,1,medium,can i chat with you?,20,5,1,0,0,1,requests.get,11,1,2,1,3,1,4,0,1,64.18,122,other,0
task_00025,1,high,Hello. I'm looking to buy a property in San Francisco that has at least 2 bedrooms and 3 bathrooms. Could you also include options that have a garage?,150,26,1,2,0,4,Homes_2_FindHomeByArea|Homes_2_ScheduleVisit|Messaging_1_ShareLocation|RideSharing_2_GetRide,15,11,12,2,1,0,0,4,1,75.8,457,scheduling,1
task_00026,1,high,"Help find a housekeeper who provides ironing services in Chonburi Province. with a review score of 4.5 stars or more, available on 12/03/2024 16:00 - 18:00 and has a history of arriving late for work",199,30,0,18,0,1,get_service_providers,20,2,4,7,9,0,0,0,1,68.1,139,other,0
task_00027,0,low,Find all Patent lawsuit cases of Facebook in 2018.,50,8,0,4,0,1,get_lawsuit_cases,3,2,2,1,0,0,0,1,0,50.33,82,vision,1
task_00028,0,low,Find a bakery that sells sourdough bread in Chicago.,52,9,0,0,0,1,grocery_shop.find_specific_product,3,2,2,0,1,0,0,0,0,57.33,88,other,0
task_00029,1,medium,Retrieve the list of services from the 'cascade-sandbox' namespace for me?,74,11,1,0,0,2,get_pods|get_services,5,2,4,0,1,0,0,0,1,86.8,166,data_query,1
task_00030,1,low,"Could you tell me the names of the current prime ministers of Australia, Canada, and India?",91,16,1,0,0,1,GetPrimeMinisters,1,1,0,0,0,1,0,0,0,207.0,79,other,1
task_00031,0,low,What is a holy book?,20,5,1,0,0,1,search_holy_books,3,1,2,1,0,0,0,0,1,37.0,50,other,0
task_00032,1,high,list the server of type,23,5,0,0,0,10,default_function|add_mtnards_server|add_postgres_server|connect_to_server|rename_server|list_servers|list_files|open_project|close_project|dartfx_help,28,13,19,4,5,0,0,6,1,86.29,997,other,0
task_00033,0,low,Provide key war events in German history from 1871 to 1945.,59,9,0,8,0,1,history.get_key_events,4,3,1,2,0,1,0,0,0,57.0,78,other,1
task_00034,0,low,Generate a major C scale progression with tempo 80 BPM and duration 4 beats.,76,12,0,3,1,1,music_generator.generate_scale_progression,4,3,2,2,0,0,0,0,1,44.75,85,audio,1
task_00035,0,medium,"""Could you calculate the area under the curve for the function 'x^3' between x values of 2 and 5 using the 'trapezoid' method of numerical integration, and then do the same calculation but using the 'simpson' method? After that, could you repeat these calculations but for the function '2x^2+3x-1' between x values of -1 and 3?""",328,53,2,9,0,1,integrate,4,3,2,2,0,0,0,0,0,62.75,79,math,1
task_00036,1,high,i hate you,10,3,0,0,0,7,detail_project|detail_experience_and_education|list_projects|experiences_and_education|contact|get_tech_stack|help.display,20,7,13,1,6,0,0,3,1,81.45,689,other,0
task_00037,1,low,Add 4 and 5 then multiply them,30,5,0,2,0,1,mult,2,2,0,2,0,0,0,0,0,34.5,47,other,0
task_00038,0,low,Find the information on motor neuron diseases,45,7,0,0,0,1,medical_records.get_disease_info,2,1,1,0,1,0,0,0,0,46.5,76,other,0
task_00039,1,high,his profile?,12,2,1,0,0,5,get_detail_adriel_project|get_adriel_list_projects|get_adriel_experiences|get_adriel_education|get_adriel_profile,17,5,9,3,5,0,0,2,1,70.88,531,other,0
task_00040,0,low,What is the current Gini Coefficient of USA?,44,8,1,0,1,1,finance.fetchGDP,3,2,2,1,0,0,0,1,0,40.0,53,other,0
task_00041,1,high,'Message' object is not subscriptable,37,5,0,0,0,4,chat_completions|generate_image|generate_completion|generation_claude,19,10,10,6,1,2,0,3,1,65.58,538,vision,0
task_00042,0,low,What's the general mood of twitter regarding the new iPhone release?,68,11,1,0,0,1,sentiment_analysis.twitter,3,2,2,1,0,0,0,0,0,38.0,66,nlp,0
task_00043,1,medium,I need help looking for a Family Therapist in Mountain View.,60,11,0,0,0,2,Services_4_BookAppointment|Services_4_FindProvider,5,5,5,0,0,0,0,1,0,83.0,171,rl,1
task_00044,0,low,What is the frequency of gene variant rs7412 in the European population?,72,12,1,4,0,1,get_dominant_trait,3,2,3,0,0,0,0,0,0,56.33,80,other,0
task_00045,0,medium,"What will be the capital gains tax for a short term capital gains of $15000, long term gains of $25000 in the state of California and $20000 short term, $50000 long term in Florida?",181,30,1,20,0,1,calculate_capital_gains_tax,3,2,1,2,0,0,0,0,1,36.33,65,math,1
task_00046,1,low,"I want to see the star history of ShishirPatil/gorilla and gorilla-llm/gorilla-cli, with the timelines aligned, so that I can more clearly observe the rate of change from their initial releases.",194,32,0,0,0,1,github_star,2,1,1,0,1,0,0,0,1,143.0,131,other,1
task_00047,1,high,"I'm traveling to Los Angeles next Monday and will need a car. let me know the options for rent cars available in Los Angeles, starting from the date 2023-04-24 at 10:00 AM and ending on 2023-04-28?",197,33,1,20,1,6,Buses_3_FindBus|Buses_3_BuyBusTicket|Flights_4_SearchOnewayFlight|Flights_4_SearchRoundtripFlights|RentalCars_3_GetCarsAvailable|RentalCars_3_ReserveCar,35,25,29,4,2,0,0,8,1,75.74,776,travel,1
task_00048,1,medium,Can you provide the latitude and longitude coordinates for latitude 37.4224764 and longitude -122.0842499 using the Geocoding API?,130,16,1,19,1,2,multiply|add,4,4,0,4,0,0,0,0,0,33.0,109,other,0
task_00049,1,medium,"Multiply the numbers [5, 9, 2]",30,3,0,3,0,2,getUserInfo|getItemInfo,2,2,0,2,0,0,0,0,0,54.5,133,other,0
task_00050,1,medium,help me,7,2,0,0,0,2,get_current_weather|add_postgres_server,8,6,7,1,0,0,0,1,1,85.5,141,travel,0
task_00051,1,medium,My name is Balkrushn and I want to use core functionality of this tool.,71,14,0,0,0,3,multiply|add|my_core_function,5,5,1,4,0,0,0,0,0,36.4,161,other,1
task_00052,0,high,"""Could you help me with the following tasks? First, I want to know the future value of my investment in the stock with the ticker symbol 'AAPL'. I have invested $5000 in it and I am expecting an annual return of 7% (0.07). I plan to hold this investment for 10 years. Second, I am interested in getting detailed information about the company 'Microsoft'. I want this information from the 'NASDAQ' stock market. Lastly, I have a quadratic equation with coefficients a=5, b=-20, and c=15. Could you solve this equation for me and provide the roots?""",547,92,2,15,2,3,solve_quadratic_equation|portfolio_future_value|get_stock_info,10,9,4,6,0,0,0,0,0,40.2,267,math,1
task_00053,1,high,"Can you find a house in Austin, TX with laundry service, for 2 adults, having a rating of at least 4.4?",103,19,1,3,1,3,Hotels_2_BookHouse|Hotels_2_SearchHouse|Travel_1_FindAttractions,12,6,9,3,0,0,0,4,1,106.33,312,travel,1
task_00054,1,low,"Hi, I am Karan. Can you tell me the current status of my Indigo flight? My ticket number is IND4567.",100,20,1,4,0,1,flight.status.check,3,3,3,0,0,0,0,0,0,116.67,93,travel,1
task_00055,1,high,"Hey, I feel like listening to some tunes right now. Can you play me Remind Me by Carrie Underwood? Pop music is my jam.",119,24,1,0,0,4,Media_3_FindMovies|Media_3_PlayMovie|Music_3_PlayMedia|Music_3_LookupMusic,12,3,11,1,0,0,0,4,1,65.42,351,audio,1
task_00056,1,low,Book a cab using Uber,21,5,0,0,0,1,play_song,4,1,4,0,0,0,0,1,1,60.5,63,travel,0
task_00057,1,medium,hi what's your name,19,4,0,0,0,1,requests.get,11,2,2,1,3,1,4,0,1,72.18,90,other,0
task_00058,1,high,"I need to set up reservations for my upcoming trip and really need your help to get this done with a minimal amount of stress. Would you help me find something fun to do during my trip, please?",193,38,1,0,0,8,Buses_3_FindBus|Buses_3_BuyBusTicket|Events_3_FindEvents|Events_3_BuyEventTickets|Flights_4_SearchOnewayFlight|Flights_4_SearchRoundtripFlights|Hotels_4_ReserveHotel|Hotels_4_SearchHotel,40,25,31,7,2,0,0,10,1,71.47,1006,travel,0
task_00059,1,high,retrieve the child projects associated with the tag 'environment' for the parent project with UUID '123e4567-e89b-12d3-a456-426614174000'?,138,20,1,27,1,5,project_api.ProjectApi.get_children_projects_by_tag|project_api.ProjectApi.get_projects_by_tag|project_api.ProjectApi.get_children_projects|project_api.ProjectApi.get_children_projects_by_classifier|project_api.ProjectApi.get_projects,14,8,7,0,7,0,0,0,1,86.79,693,data_query,1
task_00060,1,high,how about his,13,3,0,0,0,7,detail_project|detail_experience_and_education|list_projects|experiences_and_education|contact|get_tech_stack|help.display,20,7,13,1,6,0,0,3,1,81.45,689,other,0
task_00061,0,low,What is the air quality index in London 2022/08/16?,51,8,1,8,0,1,air_quality,2,2,2,0,0,0,0,0,0,62.0,55,other,1
task_00062,0,medium,"What would be the predicted forest growth in the Amazon Rainforest and the Boreal Forests of Canada over the next 10 years and 20 years, respectively, if we do not include the impact of human activities?",203,34,1,4,0,1,forest_growth_forecast,3,2,1,1,1,0,0,0,0,66.33,73,travel,1
task_00063,1,medium,I need your help finding an interesting activity please. Would you look in Portland please?,91,15,1,0,0,2,Events_3_FindEvents|Events_3_BuyEventTickets,7,6,6,1,0,0,0,1,1,83.57,188,other,0
task_00064,0,medium,Translate the phrase 'Hello World' from English to Spanish and translate 'Goodbye' from French to English. In addition to that get current time in 'Los Angeles' and 'London'.,174,28,0,0,0,2,get_current_time|translate_text,4,4,4,0,0,0,0,0,0,41.0,93,nlp,1
task_00065,0,low,What is the most visited market in New York?,44,9,1,0,0,1,museum_data.get_visit_stats,3,2,1,2,0,0,0,0,1,43.67,43,other,0
task_00066,0,low,Find the definite integral of f(x)=x^2 from x=1 to x=3.,55,12,0,3,0,1,CalculateTax,3,3,0,3,0,0,0,0,0,22.0,84,math,0
task_00067,1,high,"I was thinking about going to the cinema, I need three tickets.",63,12,0,0,0,3,Movies_1_BuyMovieTickets|Movies_1_FindMovies|Movies_1_GetTimesForMovie,15,7,14,1,0,0,0,4,1,71.33,291,other,0
task_00068,1,low,"For the website netflix.com, can I fetch 15 comments with the 'epsilon_key'?",76,13,1,2,0,1,get_current_weather,2,1,2,0,0,0,0,1,1,116.0,72,travel,0
task_00069,0,medium,"Can you give me 95% confidence interval for a sample mean with standard deviation of 10, sample size of 50 and sample mean of 25? And can you do the same but for a sample size of 150 instead?",191,34,2,11,0,1,confidence_interval.calculate,4,3,0,4,0,0,0,0,0,30.75,45,math,1
task_00070,0,medium,What is the capital of Brazil?,30,6,1,0,0,3,country_info.largest_city|country_info.capital|country_info.population,3,3,3,0,0,0,0,0,0,20.0,144,other,1
task_00071,1,medium,"Could you tell me the current weather conditions, including the temperature, wind, and precipitation, for London in the UK?",123,19,1,0,1,1,weather.get,4,2,3,0,1,0,0,1,1,71.25,117,travel,1
task_00072,1,low,9:45,4,0,0,3,0,1,play_spotify_song,3,1,2,0,1,0,0,0,1,132.33,82,other,0
task_00073,0,low,"Can you use the get_stock_prices function to retrieve the stock prices for Apple, Microsoft, Amazon, and Tesla over the duration of 1 week, 2 weeks, 3 weeks, and 1 month respectively?",183,29,1,4,0,1,get_stock_prices,2,2,1,0,0,1,0,0,0,66.5,60,data_query,1
task_00074,1,high,"tool prompt ""Find a recent news article about corona virus"".",60,10,0,0,0,6,generate_image_tool|tts_tool|write_markdown_tool|write_html_tool|search_web_tool|get_url_content,15,7,13,2,0,0,0,2,1,98.8,1271,vision,1
task_00075,1,low,show me today's date using the echo %date% command,50,9,0,0,0,1,cmd_controller.execute,1,1,1,0,0,0,0,0,0,212.0,194,other,1
task_00076,0,low,What is the percentage of population preferring digital reading over physical books?,84,12,1,0,0,1,psych_research.get_preference,4,3,4,0,0,0,0,0,1,55.25,91,other,1
task_00077,1,medium,I need help finding a rental car. I'd like a sedan that I can pick up at 6 in the evening in Phoenix.,101,22,0,1,0,2,RentalCars_3_GetCarsAvailable|RentalCars_3_ReserveCar,11,10,10,0,1,0,0,2,1,65.45,180,other,0
task_00078,1,high,"Can you find me a Music event happening in London, UK on the 2023-06-12?",72,13,1,8,1,4,Events_3_FindEvents|Events_3_BuyEventTickets|Hotels_4_ReserveHotel|Hotels_4_SearchHotel,16,11,12,3,1,0,0,3,1,75.0,389,audio,1
task_00079,1,high,"Find me homes available for purchase in San Francisco, with at least 3 bedrooms and 2 bathrooms? I'm not concerned about having a garage or in-unit laundry.",156,25,1,2,0,4,Alarm_1_GetAlarms|Alarm_1_AddAlarm|Homes_2_FindHomeByArea|Homes_2_ScheduleVisit,13,8,8,2,3,0,0,2,1,68.31,386,scheduling,1
task_00080,1,high,There is need for a car for the proposed tour. What about getting one?,70,14,1,0,0,4,Events_3_FindEvents|Events_3_BuyEventTickets|RentalCars_3_GetCarsAvailable|RentalCars_3_ReserveCar,18,16,16,1,1,0,0,3,1,73.72,446,vision,0
task_00081,0,low,"Calculate the return on investment for a stock bought at $20, sold at $25, with a dividend of $2.",97,16,0,5,0,1,calculate_return_on_investment,3,2,0,3,0,0,0,0,1,34.67,121,math,1
task_00082,0,low,"Create a new player profile for the game with name 'StarPlayer' and character class 'Mage', set the starting level to 5.",120,20,0,1,0,1,create_player_profile,3,2,2,1,0,0,0,0,1,32.67,74,other,1
task_00083,0,low,Find the top five organic bananas brands on the basis of rating from Whole Foods store.,87,16,0,0,0,1,whole_foods.find_top_brands,3,1,1,1,1,0,0,0,0,51.0,59,other,1
task_00084,1,medium,what is wrong with this,23,5,0,0,0,3,sort_list|filter_list|sum_elements,6,4,3,0,0,3,0,2,1,91.17,238,other,0
task_00085,1,low,"I have a busy day today. Can you tell me what the temperature is going to be in Bangkok, Thailand. I prefer the fahrenheit unit.",128,25,0,0,0,1,get_current_weather,2,1,2,0,0,0,0,1,1,119.5,117,travel,1
task_00086,1,medium,Find movies in the Comedy genre that feature Ellise Chappell?,61,10,1,0,0,3,Media_3_FindMovies|Media_3_PlayMovie|Weather_1_GetWeather,6,3,6,0,0,0,0,2,1,81.0,247,travel,1
task_00087,1,medium,"Can you tell me the weather in Seattle, WA on the 4th of march 2023? today is 2023.10.1",87,16,1,12,1,3,RideSharing_2_GetRide|Travel_1_FindAttractions|Weather_1_GetWeather,9,5,8,1,0,0,0,5,1,106.78,286,travel,1
task_00088,0,low,What is the time difference between Los Angeles and Berlin?,59,10,1,0,0,1,get_co_ordinate,1,1,1,0,0,0,0,0,0,39.0,56,other,0
task_00089,1,high,I am going to Los Angeles and want a house I can stay in. I need the house to have a rating of 3.7 or above and it should have laundry service.,143,31,0,2,0,3,Hotels_2_BookHouse|Hotels_2_SearchHouse|Travel_1_FindAttractions,12,6,9,3,0,0,0,4,1,106.33,312,travel,1
task_00090,1,medium,Can I know about its insole?,28,6,1,0,0,1,GetProductDetailsV1,5,1,2,2,1,0,0,1,1,72.0,90,other,0
task_00091,1,high,"Can you find me a Music event in Portland, OR that's happening on March 14th?",77,15,1,2,1,4,Events_3_FindEvents|Events_3_BuyEventTickets|Hotels_4_ReserveHotel|Hotels_4_SearchHotel,16,11,12,3,1,0,0,3,1,75.0,389,audio,1
task_00092,1,low,where this cals,15,3,0,0,0,1,classify,1,1,0,0,0,1,0,0,0,97.0,176,other,0
task_00093,1,high,"Please inform me about the weather in Portland on April 5th, 2023?",66,11,1,5,0,5,Flights_4_SearchOnewayFlight|Flights_4_SearchRoundtripFlights|RentalCars_3_GetCarsAvailable|RentalCars_3_ReserveCar|Weather_1_GetWeather,26,18,23,2,1,0,0,6,1,75.12,624,travel,1
task_00094,1,medium,The maintenance config is needed for 'sandcastle'.,50,7,0,0,0,3,get_maintenance_configs|get_maintenance_configs_v2|MaintenanceConfigurationApi.get_maintenance_config,9,4,4,4,1,0,0,2,1,64.0,241,other,1
task_00095,1,high,What's happening in China right now?,36,6,1,0,0,5,OpenWeatherMap.get_current_weather|ControlAppliance.execute|HNA_WQA.search|HNA_NEWS.search|cookbook.search_recipe,16,5,14,2,0,0,0,9,1,86.5,938,travel,1
task_00096,1,medium,help me find object detection model from torchhub apis,54,9,0,0,0,1,requests.get,11,2,2,1,3,1,4,0,1,72.18,90,vision,0
task_00097,1,high,Bring me the temperature  max entries per pages readings of all sensors please,78,13,0,0,0,3,get_sensor_readings_latest|get_sensor_readings_history_by_interval|get_sensor_readings_history,26,5,10,6,0,10,0,1,1,122.42,485,other,1
task_00098,1,medium,Search for a house accommodation in Delhi that has a review rating of at least 4.6 for two?,91,17,1,2,0,2,Hotels_2_BookHouse|Hotels_2_SearchHouse,8,5,5,3,0,0,0,1,1,82.25,216,data_query,1
task_00099,1,high,"I have a transaction, can you do it?",36,8,1,0,0,4,Payment_1_RequestPayment|Payment_1_MakePayment|Restaurants_2_ReserveRestaurant|Restaurants_2_FindRestaurants,17,10,10,3,4,0,0,4,1,84.24,516,other,0
task_00100,1,high,"Could you provide the current version information of the application, including the application name and its version number?",124,18,1,0,0,5,version_api.VersionApi.get_version|acl_api.add_mapping|acl_api.delete_mapping|acl_api.AclApi.retrieve_projects|analysis_api.AnalysisApi.retrieve_analysis,11,9,9,0,2,0,0,1,1,73.82,521,data_query,1
task_00101,0,low,What is the gene sequence for evolutionary changes in whales?,61,10,1,0,0,1,gene_sequencer,4,3,1,2,0,1,0,0,0,49.0,60,other,0
task_00102,0,low,Who initiate Protestant Reformation?,36,4,1,0,0,1,religion_history.get_event_year,3,2,3,0,0,0,0,0,1,41.33,65,other,0
task_00103,0,low,Calculate the speed of an object in km/h if it traveled 450 meters in 20 seconds.,81,15,0,5,0,1,calculate_speed,3,2,1,2,0,0,0,0,0,54.0,84,math,1
task_00104,0,low,What is the current bitcoin price?,34,6,1,0,0,1,database_connect.select,3,2,3,0,0,0,0,0,1,34.67,58,data_query,0
task_00105,1,medium,"Delete the Apdex config for ""d0404""",35,6,0,4,0,1,apdex_settings_api.ApdexSettingsApi.create_apdex_configuration,5,2,1,3,1,0,0,0,1,71.4,115,other,0
task_00106,1,high,I would like to find songs. I heard Raees is good.,50,11,0,0,0,6,Alarm_1_GetAlarms|Alarm_1_AddAlarm|Media_3_FindMovies|Media_3_PlayMovie|Music_3_PlayMedia|Music_3_LookupMusic,17,5,15,1,1,0,0,5,1,71.53,555,audio,0
task_00107,1,medium,get the contact information for the employee A1234567B?,55,9,1,7,0,3,get_current_weather|get_area_of_square|get_contact_information,5,2,4,1,0,0,0,1,1,108.6,343,travel,1
task_00108,0,medium,How much traffic should I expect from Las Vegas to Los Angeles this weekend?,76,14,1,0,0,3,calculate_distance|traffic_estimate|weather_forecast,7,6,6,1,0,0,0,0,0,44.86,181,math,1
task_00109,1,high,Find a one-way flight from JFK to LAX departing on the 15th of April 2023?,74,14,1,6,2,4,Flights_4_SearchOnewayFlight|Flights_4_SearchRoundtripFlights|Trains_1_GetTrainTickets|Trains_1_FindTrains,25,14,20,4,1,0,0,6,1,81.24,556,travel,1
task_00110,1,medium,nin,3,1,0,0,0,1,requests.get,11,2,2,1,3,1,4,0,1,72.18,90,other,0
task_00111,0,medium,"""Can you help me solve the following quadratic equations? The first one has coefficients a = 2, b = 5, and c = 3 and I want to find all roots, real or complex. The second equation has coefficients a = 1, b = -3, and c = 2 and I only want to find the real roots. The third equation has coefficients a = 4, b = -7, and c = 3 and I want to find all roots, real or complex. And the last equation has coefficients a = 1, b = 2, and c = 1 and I only want to find the real roots.""",473,84,1,12,0,1,solve_quadratic,4,3,1,3,0,0,0,0,0,75.5,188,math,1
task_00112,1,medium,Could you set a new alarm for 5 in the afternoon labeled 'Grocery run'?,71,13,1,1,0,2,Alarm_1_GetAlarms|Alarm_1_AddAlarm,5,2,3,1,1,0,0,1,1,52.8,148,other,1
task_00113,0,low,Get point and rebound stats for player 'LeBron James' from last basketball game,79,13,0,0,0,1,player_stats.getLastGame,3,2,2,0,0,1,0,0,0,60.33,60,other,1
task_00114,1,low,Help me retrieve a list of resolutions for IP 67.89.0.1 on VirusTotal. I'll use the API key 'sec_key5' and need the first 25 records.,133,23,0,9,2,1,get_current_weather,2,1,2,0,0,0,0,1,1,116.0,72,data_query,0
task_00115,0,medium,"""Can you tell me the net worth of the famous footballer Lionel Messi in Euros? After that, I would like to know the net worth of the basketball player LeBron James in British Pounds. Also, I'm curious about the Body Mass Index (BMI) of a person who weighs 85 kilograms and is 180 centimeters tall using the metric system. Lastly, could you calculate the BMI of another person who weighs 200 pounds and is 6 feet 2 inches tall using the imperial system?""",453,78,2,10,2,2,calculate_bmi|celebrity_net_worth.get,5,4,3,2,0,0,0,0,0,53.8,120,math,1
task_00116,1,medium,"I'd like to know the details for a trip to Paris, France, for 2 people, including the estimated cost. Can you provide that?",123,22,1,1,0,2,sort_array|get_trip,5,2,2,1,1,1,0,0,1,74.8,156,travel,0
