task_uid,is_live_benchmark,task_complexity,query,query_char_length,query_word_count,query_question_marks,query_digit_count,query_uppercase_words,num_available_tools,tool_names,total_params,total_required_params,num_string_params,num_numeric_params,num_boolean_params,num_array_params,num_object_params,num_enum_params,has_default_values,avg_param_description_length,tool_description_total_length,task_domain,can_answer
task_01802,1,medium,Can you find a Family genre movie that features Carol Sutton?,61,11,1,0,0,3,Events_3_FindEvents|Events_3_BuyEventTickets|Movies_3_FindMovies,10,6,9,1,0,0,0,2,1,100.0,273,other,1
task_01803,0,low,What is the area under the curve of the function f(x) = 3x^2 from x = 1 to x = 5?,81,17,1,4,0,1,draw_circle,2,2,1,1,0,0,0,0,0,53.0,43,other,0
task_01804,1,medium,can you remove background from cat.jpeg,39,7,0,0,0,1,requests.get,11,1,2,1,3,1,4,0,1,93.55,91,other,0
task_01805,1,high,我想在 mbox 系统中创建一个新的工作空间，基于 git 仓库的 master 分支。工作空间的名字叫做 'DevelopersHub'。,70,4,0,0,0,4,get_current_weather|start_oncall|create_workspace|generate_password,9,6,6,1,2,0,0,2,1,80.56,543,nlp,1
task_01806,1,medium,I just enjoyed a large cup of chai tea with half and half for my morning snack. Could you record that I drank 16 ounces of chai tea as a snack?,143,30,1,2,0,1,log_food,4,3,3,1,0,0,0,1,1,83.5,88,other,1
task_01807,0,low,How many teaspoons are in 2 tablespoons for measurement in my recipe?,69,11,1,1,0,1,recipe.unit_conversion,4,3,2,2,0,0,0,0,0,65.5,70,other,1
task_01808,1,medium,"Will you get me something fun in London, England?",49,9,1,0,0,3,Events_3_FindEvents|Events_3_BuyEventTickets|RideSharing_2_GetRide,10,9,8,2,0,0,0,4,1,82.4,276,other,0
task_01809,0,medium,"""Could you please find the latest updates for the game 'Call of Duty' on the 'Playstation' platform for the 'European' region, then find the current price for the same game on the 'Xbox' platform, and finally find reviews for the game 'FIFA 21' from the 'American' region?""",273,46,1,2,1,3,games.update.find|games.reviews.find|games.price.find,7,5,7,0,0,0,0,0,0,41.57,193,other,1
task_01810,1,high,"I need to register a new MTNA Rich Data Services server with the nickname 'FastQuery' and the host rds.example.org, and I have an API key '1231231' to associate with it.",169,31,0,7,2,10,default_function|add_mtnards_server|add_postgres_server|connect_to_server|rename_server|list_servers|list_files|open_project|close_project|dartfx_help,28,13,19,4,5,0,0,6,1,86.29,997,other,1
task_01811,1,medium,I want to listen to 'With You' by AP Dillon. Could you set the volume to 50?,76,16,1,2,1,2,set_volume|play_song,4,2,1,2,1,0,0,0,1,90.0,206,other,1
task_01812,1,high,"I need to rent a car in Los Angeles, from March 9th to March 10th 2023. I'd prefer a Sedan. I want to pick up at 9 am. Check the availability for me.",149,31,0,8,0,6,Buses_3_FindBus|Buses_3_BuyBusTicket|Flights_4_SearchOnewayFlight|Flights_4_SearchRoundtripFlights|RentalCars_3_GetCarsAvailable|RentalCars_3_ReserveCar,35,25,29,4,2,0,0,8,1,75.74,776,travel,1
task_01813,1,low,What is the sum of 133 and 34?,30,6,1,5,0,1,calculate_sum,2,2,0,2,0,0,0,0,0,59.5,41,math,1
task_01814,1,low,I have an audio file that I'd like to analyze. Could you identify significant beats for me if I set the capture percentage to 70 and the confidence window size to 0.8 seconds?,175,31,1,4,0,1,detect_beats_and_filter,2,2,0,2,0,0,0,0,0,125.5,208,audio,1
task_01815,0,low,What is the final speed of an object dropped from rest after falling for 5 seconds if we neglect air resistance?,112,20,1,1,0,1,calculate_final_speed,3,1,0,3,0,0,0,0,0,62.67,161,math,1
task_01816,1,high,"I'm interested in seeing a 3D movie at the Raven Film Center in Healdsburg, CA.",79,15,0,1,1,3,Movies_1_BuyMovieTickets|Movies_1_FindMovies|Movies_1_GetTimesForMovie,15,7,14,1,0,0,0,4,1,73.47,291,other,1
task_01817,1,high,"Find available hotels in Phoenix, AZ for me?",44,8,1,0,1,5,Flights_4_SearchOnewayFlight|Flights_4_SearchRoundtripFlights|Hotels_4_ReserveHotel|Hotels_4_SearchHotel|Travel_1_FindAttractions,26,13,20,4,2,0,0,10,1,91.92,653,travel,1
task_01818,1,high,I'm interested in a horror movie featuring Gwendoline Christie and directed by Peter Strickland. Can you find one for me?,121,20,1,0,0,3,Movies_3_FindMovies|Music_3_PlayMedia|Music_3_LookupMusic,11,1,11,0,0,0,0,4,1,69.55,231,audio,1
task_01819,0,low,"What is the current price per ounce of gold, silver, platinum, and palladium?",77,13,1,0,0,1,get_metal_price,2,2,2,0,0,0,0,0,0,45.5,61,other,1
task_01820,1,high,"I'd like to listen to 'Shape of You' by Ed Sheeran in the living room now, could you play it for me?",100,22,1,0,0,6,Alarm_1_GetAlarms|Alarm_1_AddAlarm|Media_3_FindMovies|Media_3_PlayMovie|Music_3_PlayMedia|Music_3_LookupMusic,17,5,16,0,1,0,0,5,1,73.35,555,audio,1
task_01821,0,low,What are the primary triads in the key of C major?,50,11,1,0,0,1,music_analysis.find_common_chords,2,2,1,1,0,0,0,0,0,36.0,57,audio,0
task_01822,0,medium,"""Could you use the 'predict_house_price' function to compare the estimated prices of four different houses? The first house is located in New York, has 3 bedrooms, 2 bathrooms, and an area of 1500 square feet. The second house is in Los Angeles, with 4 bedrooms, 3 bathrooms, and an area of 2000 square feet. The third house is in Chicago, with 2 bedrooms, 1 bathroom, and an area of 1200 square feet. The fourth house is in Miami, with 3 bedrooms, 2 bathrooms, and an area of 1800 square feet.""",495,80,1,24,0,1,predict_house_price,4,4,1,3,0,0,0,0,0,34.0,93,other,1
task_01823,0,low,How many greenhouse gas emissions would I save if I switched to renewable energy sources for 3 months in California?,116,19,1,1,0,1,calculate_emission_savings,3,2,2,1,0,0,0,0,0,37.67,92,nlp,1
task_01824,0,low,Can you recommend a good movie to watch?,40,8,1,0,0,1,word_count,2,2,2,0,0,0,0,0,0,47.5,54,other,0
task_01825,1,high,I want to explore movies in the fantasy genre that feature Emma Watson.,71,13,0,0,0,5,Media_3_FindMovies|Media_3_PlayMovie|Music_3_PlayMedia|Music_3_LookupMusic|Travel_1_FindAttractions,16,4,16,0,0,0,0,8,1,98.62,451,audio,1
task_01826,1,high,"Hi, find me a one-way flight from JFK to LAX for the 15th of April 2023? I would like to travel in Premium Economy class.",121,24,1,6,2,4,Flights_4_SearchOnewayFlight|Flights_4_SearchRoundtripFlights|Trains_1_GetTrainTickets|Trains_1_FindTrains,25,14,20,4,1,0,0,6,1,78.0,556,travel,1
task_01827,1,high,"Find me trains departing from Phoenix, AZ to Los Angeles on April 25, 2023?",75,12,1,6,1,4,Hotels_2_BookHouse|Hotels_2_SearchHouse|Trains_1_GetTrainTickets|Trains_1_FindTrains,20,13,14,5,1,0,0,5,1,77.4,519,travel,1
task_01828,1,high,I'm looking for a cleaning service provider with a high average rating and located in Bangkok. Can you help me find one that's also recognized for excellent service?,165,28,1,0,0,2,get_service_providers|view_service_provider_profile,21,1,4,8,9,0,0,3,1,99.19,220,other,1
task_01829,1,high,Hello. I need your help finding a hotel in Vancouver. I'll need just one room and would prefer a three star hotel.,114,22,0,0,0,5,Flights_4_SearchOnewayFlight|Flights_4_SearchRoundtripFlights|Hotels_4_ReserveHotel|Hotels_4_SearchHotel|Travel_1_FindAttractions,26,13,20,4,2,0,0,10,1,91.92,653,travel,1
task_01830,1,medium,"Help find a housekeeper who provides ironing services in Chonburi Province. with a review score of 4.5 stars or more, available on 12/03/2024 16:00 - 18:00.",156,21,0,18,0,1,get_service_providers,7,1,4,3,0,0,0,0,1,107.71,121,other,1
task_01831,1,medium,"Search for a four-star hotel in Toronto, Canada? I would like to reserve one room.",82,15,1,0,0,2,Hotels_4_ReserveHotel|Hotels_4_SearchHotel,9,5,7,1,1,0,0,3,1,85.22,118,data_query,1
task_01832,1,high,I am looking for a Psychiatrist in Santa Rosa.,46,9,0,0,0,6,Payment_1_RequestPayment|Payment_1_MakePayment|Restaurants_2_ReserveRestaurant|Restaurants_2_FindRestaurants|Services_4_BookAppointment|Services_4_FindProvider,23,16,15,3,5,0,0,4,1,75.09,639,rl,1
task_01833,0,low,Fetch all records for students studying Science in 'Bluebird High School' from the StudentDB.,93,14,0,0,0,1,db_fetch_records,4,3,2,1,0,0,1,0,0,55.0,74,other,1
task_01834,0,medium,Calculate the future value of my portfolio if I invest $5000 in stock 'X' with an expected annual return of 5% for 7 years.,123,21,0,6,0,1,portfolio_future_value,4,4,1,3,0,0,0,0,0,45.0,137,math,1
task_01835,1,medium,"Help find a housekeeper who provides ironing services in Chonburi Province. with a review score of 4.5 stars or more, available tomorrow, today is 20230929",155,23,0,10,0,1,get_service_providers,6,1,3,3,0,0,0,0,1,134.0,89,other,1
task_01836,1,high,enter,5,1,0,0,0,5,user_api.UserApi.create_managed_user|oidc_api.add_mapping_2|ldap_api.LdapApi.add_mapping_1|user_api.UserApi.add_team_to_user|cwe_api.CweApi.get_cwe,22,10,15,3,1,3,0,3,1,67.55,482,other,0
task_01837,1,medium,"I'm in the mood for a good laugh. Explore some Comedy movies for me, maybe something with Jim Carrey in it?",107,21,1,0,0,3,Media_3_FindMovies|Media_3_PlayMovie|Weather_1_GetWeather,6,3,6,0,0,0,0,2,1,81.0,247,travel,1
task_01838,0,low,Who was the President of the United States in 1940?,51,9,1,4,0,1,history_api.get_president_by_year,2,1,0,1,1,0,0,0,1,74.5,56,other,1
task_01839,1,low,"disconnect wifi, using the command netsh wlan disconnect",56,8,0,0,0,1,cmd_controller.execute,2,1,2,0,0,0,0,1,1,106.5,141,other,1
task_01840,1,medium,I would like to find a SUV till 7th of March.,45,11,0,1,1,2,RentalCars_3_GetCarsAvailable|RentalCars_3_ReserveCar,11,10,10,0,1,0,0,2,1,65.45,180,other,0
task_01841,1,low,use calculator to cope with problems,36,6,0,0,0,1,compute_statistics,3,1,0,1,1,1,0,0,1,91.0,106,math,0
task_01842,0,low,Find the distance in kilometers from San Francisco to Los Angeles.,66,11,0,0,0,1,get_date,3,2,3,0,0,0,0,1,0,34.33,59,other,0
task_01843,0,medium,"Determine my personality type based on the five factor model with given information: I'm talkative, gets nervous easily, has few artistic interests, tend to be lazy and has a forgiving nature.",192,31,0,0,0,2,MBTI.analyse|five_factor_model.analyse,9,9,4,0,5,0,0,0,0,44.78,307,nlp,1
task_01844,1,medium,I need a schedule to see a property.,36,8,0,0,0,2,Homes_2_FindHomeByArea|Homes_2_ScheduleVisit,8,6,4,2,2,0,0,1,1,82.88,378,scheduling,0
task_01845,0,low,Calculate the factorial of the number 5,39,6,0,1,0,1,math.factorial,1,1,0,1,0,0,0,0,0,32.0,42,math,1
task_01846,0,medium,How to assess the population growth in deer and their impact on woodland in Washington state over the past decade?,114,20,1,0,0,2,wildlife_population.assess_growth|ecological_impact.analyze,7,6,5,2,0,0,0,0,1,51.14,150,other,1
task_01847,1,medium,I'm planning to bake a cake Pre heat the oven for 36 minutes at 201 degrees.,76,14,0,5,0,2,run_microwave|oven_preheat,5,3,2,3,0,0,0,2,1,51.6,123,other,1
task_01848,0,low,Find two movie theatres near San Diego with availability for Tenet at 5 pm and No Time To Die at 7:30 pm.,105,20,0,4,0,1,find_movie_showing,3,3,1,0,0,2,0,0,0,21.0,65,other,1
task_01849,0,high,"""Can you help me plan a trip? I need to know the distance in kilometers from New York to London using the 'geodistance.find' function, then I want to know the time difference between New York and London using the 'timezones.get_difference' function. After that, I want to find flights from New York to London on the date of 'next friday' using the 'flights.search' function. Finally, I want to know the distance in miles from London to Paris using the 'geodistance.find' function again.""",487,86,1,0,0,3,flights.search|timezones.get_difference|geodistance.find,8,6,8,0,0,0,0,0,1,34.62,126,travel,1
task_01850,0,high,"""Can you help me with a few tasks? First, I need to book a hotel room in Paris for 5 nights starting from 20th June. I prefer a deluxe room and would like the hotel to have a gym and offer free breakfast. Secondly, I am curious about the last match played by the soccer club 'Manchester United'. Could you fetch the details for me? Also, include the match statistics. Lastly, I recently measured my weight and height. I weigh 75 kilograms and my height is 1.8 meters. Could you calculate my Body Mass Index (BMI)?""",514,93,3,7,1,3,hotel_booking|soccer.get_last_match|calculate_BMI,9,7,4,3,1,1,0,0,0,51.11,239,rl,1
task_01851,0,medium,"""Can you calculate the electric field strength at a distance of 0.5 meters from a point charge of 2 Coulombs located in a vacuum? Then, can you also calculate the electric field strength at a distance of 1 meter and 2 meters from the same point charge? Lastly, can you calculate the electric field strength at a distance of 1 meter from the same point charge but this time located in air?""",389,67,3,6,0,1,calculate_electric_field_strength,3,2,1,2,0,0,0,0,0,51.33,80,math,1
task_01852,1,high,"Could you search for a bus itinerary for me? I need to travel from Philadelphia, PA to New York City, NY on March 14th.",119,24,1,2,2,4,Buses_3_FindBus|Buses_3_BuyBusTicket|Hotels_4_ReserveHotel|Hotels_4_SearchHotel,20,12,14,4,2,0,0,5,1,79.85,567,nlp,1
task_01853,1,high,I am in a nice mood and I like to listen to some nice songs. Can you search for something best for me? Can you find me some Electropop tracks from 2018?,152,31,2,4,0,4,Media_3_FindMovies|Media_3_PlayMovie|Music_3_PlayMedia|Music_3_LookupMusic,12,3,11,1,0,0,0,4,1,65.42,351,audio,1
task_01854,1,medium,I'm thinking about finding a salon in Berkeley,46,8,0,0,0,2,Services_1_BookAppointment|Services_1_FindProvider,5,4,4,0,1,0,0,0,1,89.6,205,rl,1
task_01855,1,high,Find a service provider that provides ironing services.In Bangkok,65,10,0,0,0,2,get_service_providers|view_service_provider_profile,18,2,4,7,6,1,0,0,1,133.0,206,other,1
task_01856,0,high,"""Could you help me with some calculations? First, I have two vectors, [1, 2, 3] and [4, 5, 6], and I need to calculate the cosine similarity between them. I want the result to be rounded off to 2 decimal places. Then, I have two arrays of numbers, [7, 8, 9] and [10, 11, 12], and I need to calculate the Pearson correlation coefficient between them. After that, I have another two arrays of numbers, [13, 14, 15] and [16, 17, 18], and I need to calculate the Spearman correlation coefficient between them. Lastly, I have two more vectors, [19, 20, 21] and [22, 23, 24], and I need to calculate the cosine similarity between them, but this time I want the result to be rounded off to 3 decimal places.""",701,105,1,41,0,2,cosine_similarity.calculate|correlation.calculate,6,4,1,1,0,4,0,1,0,51.0,120,math,1
task_01857,1,high,help,4,1,0,0,0,6,get_detail_adriel_project|get_adriel_detail_experience_and_education|get_adriel_list_projects|get_adriel_experiences_and_education|get_adriel_profile|get_adriel_tech_stack,13,5,8,1,4,0,0,3,1,77.38,644,other,0
task_01858,1,medium,"{     ""response"": "" The image contains four logos of superheroes from DC Comics and Marvel Comics. They are Superman, Iron Man, Hulk, and Batman. The logos are all in different colors and shapes. Superman's logo is a red and yellow \""S\"" on a blue background. Iron Man's logo is a red and yellow circle with a black face mask. Hulk's logo is a green fist with a black outline. Batman's logo is a black bat on a yellow background.\n\nHere is a list of objects that could contain copyrighted material:\n\n* Blue square\n* Red square\n* Green square\n* Yellow square\n* Superman logo\n* Iron Man logo\n* Hulk logo\n* Batman logo\n* Fist\n* Bat\n* Face mask\n* Outline"" }",667,124,0,0,1,1,get_items,1,1,0,0,0,1,0,0,0,98.0,76,vision,1
task_01859,0,low,Who is playing basketball game  at Madison Square Garden tonight?,65,10,1,0,0,1,concert_search.find_concerts,3,2,3,0,0,0,0,0,0,64.67,55,other,0
task_01860,0,low,How much time will it take to cook a roast chicken of 1.5 kg?,61,13,1,2,0,1,calculate_cooking_time,3,1,1,2,0,0,0,0,0,47.33,47,math,1
task_01861,1,low,"It's sooo hot. set the air conditioner to 'COOL' mode, temp to 20 degrees oC, while air cleaning on?",100,18,1,2,1,1,ThinQ_Connect,1,1,0,0,0,0,1,0,0,69.0,116,nlp,1
task_01862,1,medium,hi,2,1,0,0,0,1,user_authentication.login,6,2,4,1,1,0,0,0,1,92.33,155,other,0
task_01863,1,low,Can you order me a luxurious cab to 1270 Linford Lane?,54,10,1,4,0,1,RideSharing_2_GetRide,3,3,2,1,0,0,0,1,0,96.33,93,other,0
task_01864,1,high,Help find housekeeper profile ID 4724,37,5,0,4,1,2,get_service_providers|view_service_provider_profile,21,1,4,8,9,0,0,3,1,99.19,220,other,1
task_01865,0,medium,Give me a recipe for a vegetarian pasta with cheese for 2 servings.,67,12,0,1,0,3,detailed_weather_forecast|recipe_search|get_time_difference,8,7,4,2,1,1,0,0,0,43.5,241,travel,1
task_01866,0,low,"Calculate the Compound Annual Growth Rate (CAGR) for an initial investment of $2000, final value of $3000 in a period of 4 years.",129,20,0,9,1,1,calculate_cagr,3,3,0,3,0,0,0,0,0,31.33,134,math,1
task_01867,1,medium,When will size 40 be available?,31,5,1,2,0,1,ProductSearch.execute,5,1,4,0,1,0,0,2,1,107.2,146,other,0
task_01868,1,medium,Fetch all.,10,2,0,0,0,2,user.mandates|partner.mandates,3,1,3,0,0,0,0,2,1,87.33,334,nlp,0
task_01869,1,high,"I'm trying to fix a compilation error in my Java project. Specifically, the class 'StringNumberHandler' extends 'AbstractCellHandler' and overrides several methods like 'getCellValue', 'setCellValue', 'getExcelType', and 'getDefaultExcelFormat'. However, I'm getting an error saying that the method 'getNumericValue()' cannot be found in 'CellResult'. Find relevant classes that might be related to 'CellResult' in the repository including subdirectories? Also, could you provide the signatures of 'setCellValue' and 'getCellValue' methods in the 'AbstractCellHandler' class to ensure I'm overriding them correctly?",615,77,2,0,0,4,get_class_info|get_signature|get_relevant_classes|get_imports,12,6,7,0,5,0,0,1,1,86.58,627,other,1
task_01870,1,low,I'm planning a picnic on the 4th march 2023 and would like to know the forecast for Campbell on that day. Could you provide that information?,141,25,1,5,0,1,Weather_1_GetWeather,2,1,2,0,0,0,0,0,1,95.0,73,travel,1
task_01871,0,low,What were the stock prices of Apple Inc. listed on NASDAQ and Microsoft Corporation listed on NYSE for the past 10 and 15 days respectively?,140,23,1,4,2,1,get_stock_price,3,2,2,1,0,0,0,0,0,51.33,63,finance,1
task_01872,1,low,You are Sara,12,3,0,0,0,1,introduction.greet,4,3,3,0,1,0,0,1,1,56.25,94,other,0
task_01873,1,low,"Can you tell me the forecast for Pacifica on April 11th, 2023?",62,11,1,6,0,1,Weather_1_GetWeather,2,1,2,0,0,0,0,0,1,95.0,73,travel,1
task_01874,1,low,北京的房价是多少,8,0,0,0,0,1,get_current_weather,2,1,2,0,0,0,0,1,1,116.0,72,travel,0
task_01875,0,medium,"""Could you first analyze the structure of a building with the building_id 'B1234' for floors 1, 2, 3, and 4 using the 'dynamic' mode of analysis? Then, could you retrieve the player statistics for 'Michael Jordan' for the year 1996? After that, can you analyze the structure of another building with the building_id 'B5678' for floors 5, 6, 7, and 8 using the 'static' mode of analysis? Finally, could you retrieve the player statistics for 'LeBron James' for the year 2018, specifically for his time with the 'Los Angeles Lakers' team?""",537,83,4,24,0,2,analyze_structure|player_statistic,6,4,4,1,0,1,0,0,0,45.67,127,data_query,1
task_01876,1,high,Can you provide me with the list of projects that Adriel is currently working on? I need to know the details and the status of each project. id 1234,148,28,1,4,0,7,detail_adriel_project|adriel_detail_experience_and_education|adriel_list_projects|adriel_experiences_and_education|adriel_contact|adriel_tech_stack|help,13,4,9,1,3,0,0,4,1,75.0,855,other,1
task_01877,1,medium,"You are a FoxMatrix AI Assistant. Your task is to assist users in providing details related to interviews, interviewer, interviewee/candidate, and the feedback of the interviews. As a chatbot, you should focus solely on FoxMatrix interview-related tasks and refrain from providing information outside this domain. Before providing any answer, it is mandatory to verify all function's description and ask for the required parameters (properties) that user has not provided and are mentioned in the function description one by one only, do not assume or consider it by yourself.  Please ensure careful consideration of user input and responses as it impacts the business. Additionally, track previous user input to avoid asking the same question again. Your role is crucial in providing interview details.  Engage users in meaningful conversations, address their queries promptly, and facilitate a seamless interview experience. Your communication style should be friendly and polite meant to answer questions based on a knowledge base. Don't make assumptions about what values to use with functions.",1098,165,0,0,1,1,get_interviewer_list,3,1,2,0,1,0,0,2,1,81.67,120,nlp,0
task_01878,0,low,"Calculate the profit margin of a company with revenue of $200,000 and expenses of $150,000.",91,13,0,12,0,1,calculate_ROI,3,2,0,3,0,0,0,0,1,37.67,86,math,0
task_01879,1,low,"What are the current weather conditions in Tel Aviv, and could you provide that in Fahrenheit, please?",102,17,1,0,0,1,get_current_weather,2,1,2,0,0,0,0,1,1,119.5,117,travel,1
task_01880,0,medium,Calculate the greatest common divisor between 128 and 256.,58,7,0,6,0,2,calculate_lcm|calculate_gcd,6,4,2,4,0,0,0,1,0,59.0,128,math,1
task_01881,0,low,Generate a DNA sequence with 100 bases including more G (Guanine) and C (Cytosine).,83,13,0,3,1,1,generate_DNA_sequence,2,2,0,1,0,1,0,0,0,58.0,80,nlp,1
task_01882,1,high,Show me the profile information for the service provider with the UID of 1?,75,13,1,1,1,2,get_service_providers|view_service_provider_profile,21,3,4,8,9,0,0,1,1,64.86,142,other,1
task_01883,1,low,"Could you tell me how to obtain just the IDs and context attributes, and not all the details, of the CAA records for 'sample2.com'? I'll be using my API key 'secret567'.",169,32,1,4,2,1,get_current_weather,2,1,2,0,0,0,0,1,1,116.0,72,nlp,0
task_01884,1,low,list file in desktop using dir Desktop,38,7,0,0,0,1,cmd_controller.execute,2,1,2,0,0,0,0,1,1,105.5,92,other,1
task_01885,1,low,I am a pretty girl,18,5,0,0,0,1,translate_english_to_chinese,2,1,2,0,0,0,0,1,1,48.5,48,nlp,0
task_01886,0,medium,Find the final velocity of an object thrown up at 40 m/s after 6 seconds.,73,14,0,3,0,3,physics.wave_velocity|kinematics.final_velocity|kinematics.distance,8,6,0,8,0,0,0,0,0,50.5,218,other,1
task_01887,1,high,Returns application version information,39,4,0,0,0,5,version_api.VersionApi.get_version|badge_api.BadgeApi.get_project_vulnerabilities_badge|project_api.ProjectApi.get_project_by_name_and_version|badge_api.BadgeApi.get_project_policy_violations_badge1|bom_api.BomApi.export_project_as_cyclone_dx,10,7,9,0,1,0,0,2,1,103.8,555,nlp,1
task_01888,0,low,Which online bookstore sells 'To Kill a Mockingbird'?,53,8,1,0,0,1,add_product_to_cart,3,2,0,3,0,0,0,0,1,41.67,58,other,0
task_01889,0,medium,I want to order a large pepperoni pizza and a chicken Caesar salad from Whole Foods at the downtown location and then another order of the same items from the uptown location.,175,32,0,0,0,1,whole_foods.order,3,3,2,0,0,1,0,1,0,21.67,27,other,1
task_01890,1,low,Play high quality Roar by Katy Perry. The song_id is wjeiruhuq_roar.,68,13,0,0,0,1,play_song,4,1,4,0,0,0,0,1,1,60.5,63,other,1
task_01891,1,high,I'm curious about the current top news involving Ji Sung Park. Can you search for recent news articles that mention him? And let's limit it to 5 articles.,154,27,1,1,0,5,OpenWeatherMap.get_current_weather|ControlAppliance.execute|HNA_WQA.query|HNA_NEWS.search|HNA_COOKBOOK.search_recipe,15,6,11,3,1,0,0,5,1,104.87,767,data_query,1
task_01892,1,medium,Whst is the temperature in Antwerpen,36,6,0,0,0,1,requests.get,11,1,2,1,3,1,4,0,1,93.55,91,other,0
task_01893,0,low,Calculate the balance of a mutual fund given a total investment of $50000 with a 5% annual yield after 3 years.,111,18,0,7,0,1,calculate_mutual_fund_balance,3,3,0,3,0,0,0,0,0,40.67,133,math,1
task_01894,1,high,what's the weather like in Hanoi?,33,6,1,0,0,4,Hotels_2_BookHouse|Hotels_2_SearchHouse|Trains_1_GetTrainTickets|Trains_1_FindTrains,20,13,13,5,2,0,0,5,1,77.4,519,travel,0
task_01895,0,medium,"Create a square painting with blue background and dimensions 16x16 inches, then display it for 30 seconds with 70% screen brightness",132,19,0,8,0,3,painting.create|display.set_screen_brightness|painting.display,6,6,2,3,0,1,0,0,0,41.33,156,other,1
task_01896,1,high,Do you know Microsoft?,22,4,1,0,0,4,get_current_weather|start_oncall|create_workspace|generate_password,9,6,6,1,2,0,0,2,1,80.56,543,nlp,0
task_01897,1,low,The user did not provide a query,32,7,0,0,0,1,get_value_chat,4,2,1,2,1,0,0,1,1,122.0,143,other,0
task_01898,1,low,"Can you tell me the current geographical coordinates of my device in DMS format, including altitude?",100,16,1,0,1,1,get_current_loc,3,0,1,1,1,0,0,1,1,75.33,118,other,1
task_01899,1,high,최근 박지성에 관한 뉴스를 찾아줘.,19,0,0,0,0,5,OpenWeatherMap.get_current_weather|ControlAppliance.execute|HNA_WQA.search|HNA_NEWS.search|cookbook.search_recipe,16,5,14,2,0,0,0,9,1,86.5,938,travel,1
task_01900,0,low,What are the opening hours of the Metropolitan Museum of Art on Saturday?,73,13,1,0,0,1,get_museum_hours,2,2,2,0,0,0,0,1,0,19.5,67,other,1
task_01901,1,medium,I want a AI girfriend.,22,5,0,0,1,1,requests.get,11,2,2,1,3,1,4,0,1,72.18,90,other,0
task_01902,1,high,Find the name of the movie directed by Joel Zwick that Joey Fatone acted in?,76,15,1,0,0,3,Movies_3_FindMovies|Restaurants_2_ReserveRestaurant|Restaurants_2_FindRestaurants,13,6,10,1,2,0,0,3,1,93.46,378,other,1
task_01903,0,medium,Calculate the time required for a car moving at 50 m/s to travel a distance of 600 m. Also calculate the time required for a bullet moving at 400 m/s to cover a distance of 1000 m.,180,35,0,12,0,2,physics.calculate_force|kinematics.calculate_time,4,4,0,4,0,0,0,0,0,37.0,192,math,1
