task_uid,is_live_benchmark,task_complexity,query,query_char_length,query_word_count,query_question_marks,query_digit_count,query_uppercase_words,num_available_tools,tool_names,total_params,total_required_params,num_string_params,num_numeric_params,num_boolean_params,num_array_params,num_object_params,num_enum_params,has_default_values,avg_param_description_length,tool_description_total_length,task_domain,can_answer
task_00861,0,medium,"What would be the predicted evolutionary rate for the African Elephant species over a period of 5000 years using the Darwin model, and how would this prediction change if we use the Lamarck model instead?",204,34,1,4,0,1,prediction.evolution,3,2,2,1,0,0,0,0,0,60.67,75,other,1
task_00862,1,low,I'm interested in the VirusTotal report of the domain microsoft.com. My access token is MS_key321.,98,17,0,3,0,1,get_current_weather,2,1,2,0,0,0,0,1,1,116.0,72,travel,0
task_00863,1,high,May I see the alarms that I have set? with user id 12345,56,12,1,5,0,7,Alarm_1_GetAlarms|Alarm_1_AddAlarm|Messaging_1_ShareLocation|RentalCars_3_GetCarsAvailable|RentalCars_3_ReserveCar|Restaurants_2_ReserveRestaurant|Restaurants_2_FindRestaurants,27,20,22,1,4,0,0,4,1,75.41,777,other,1
task_00864,1,medium,"Hello, I just completed a sales transaction with several products. Could you adjust the inventory for these items: 3 units of a product ID, 2 units of another product ID, and 5 units of the last product ID? The current restock threshold is set at 5 units.",255,43,1,4,3,1,update_inventory,3,1,1,1,0,1,0,0,1,112.0,201,finance,0
task_00865,1,medium,Can you find me some songs from the album High Expectations released in 2019?,77,13,1,4,0,2,Music_3_PlayMedia|Music_3_LookupMusic,8,1,8,0,0,0,0,3,1,73.0,180,audio,1
task_00866,1,low,"Bro, are 12 pairs of size L underwear available?",48,8,1,2,0,1,user_authentication.login,4,2,2,1,1,0,0,0,1,43.75,119,other,0
task_00867,0,low,What is the magnetic field at a point located at distance 'r' from a wire carrying current 'I'?,95,18,1,0,0,1,magnetic_field_intensity,3,2,0,3,0,0,0,0,0,67.33,107,other,0
task_00868,0,low,"Calculate the distance between two GPS coordinates (33.4484 N, 112.0740 W) and (34.0522 N, 118.2437 W) in miles.",112,14,0,26,1,1,calculate_distance,3,3,1,0,0,2,0,0,0,48.67,51,math,1
task_00869,0,medium,Provide me the official crime rate of violent crime in San Francisco in 2020.,77,13,0,4,0,2,get_crime_rate|poker_game_winner,7,4,4,1,0,1,1,0,0,44.57,98,nlp,1
task_00870,0,medium,Calculate the final temperature when 2 moles of gas at 300 K are mixed with 3 moles of the same gas at 400 K.,109,20,0,8,0,2,calculate_final_temperature|calculate_mass,6,6,0,6,0,0,0,0,0,36.33,172,math,1
task_00871,0,medium,"What is the wind speed and temperature in location given by coordinates 46.603354,1.8883340 on December 13, 2019?",113,14,1,22,0,3,weather.get_by_city_date|weather.get_forecast_by_coordinates|weather.get_by_coordinates_date,6,5,3,1,0,2,0,0,0,94.5,194,travel,1
task_00872,1,medium,yang cream kapan ready lagi kak,31,6,0,0,0,1,ProductSearch.execute,5,1,4,0,1,0,0,2,1,107.2,146,other,0
task_00873,1,medium,"Rename website ""Frank"" to ""Bob"". Web ID is 1234",47,8,0,4,1,3,website_configuration_api.WebsiteConfigurationApi.rename_website|website_configuration_api.WebsiteConfigurationApi.create_website|website_configuration_api.delete_website,4,4,4,0,0,0,0,0,0,44.0,270,other,1
task_00874,0,low,Find the probability of getting exactly 5 heads in 10 fair coin tosses.,71,11,0,3,0,1,prob_dist.binomial,3,2,0,3,0,0,0,0,0,43.0,79,other,1
task_00875,0,low,What's the latest trend in technology?,38,6,1,0,0,1,get_social_trends,2,2,2,0,0,0,0,0,0,51.5,45,other,0
task_00876,0,medium,"""Could you please help me find the price of the artwork named 'Starry Night' by the artist 'Vincent Van Gogh' on the 'Sotheby' auction platform, and then fetch the price of another artwork called 'The Scream' by 'Edvard Munch' on the 'Christie' platform? After that, I would like to search for a book titled 'To Kill a Mockingbird' by the author 'Harper Lee' in the 'New York Public Library', and then look for another book named '1984' by 'George Orwell' in the 'British Library'.""",482,83,1,4,0,2,library.search_book|art_auction.fetch_artwork_price,6,4,6,0,0,0,0,0,1,51.33,104,data_query,1
task_00877,0,low,Who won the 1996 NBA championships?,35,5,1,4,1,1,playoff.brackets,2,2,1,1,0,0,0,1,0,34.5,50,other,0
task_00878,1,high,I am looking for a Science related movie to watch. I prefer something with the actor James Keane that is directed by Steven Spielberg,133,24,0,0,0,3,Movies_3_FindMovies|Restaurants_2_ReserveRestaurant|Restaurants_2_FindRestaurants,13,6,10,1,2,0,0,3,1,93.46,378,other,1
task_00879,0,low,Find me a multiplayer game with rating above 4.5 and compatible with Windows 10.,80,12,0,4,0,1,multiplayer_game_finder,3,2,2,1,0,0,0,1,0,63.33,105,other,1
task_00880,1,low,Apple revenue was $21 billion.,30,4,0,2,0,1,requests.get,4,1,1,1,0,0,2,0,1,61.0,83,other,0
task_00881,1,high,I need to transfer $250 to Svetlana using my in-app balance. Could you make it private as well?,95,17,1,3,0,5,Payment_1_RequestPayment|Payment_1_MakePayment|Trains_1_GetTrainTickets|Trains_1_FindTrains|Weather_1_GetWeather,21,14,14,4,3,0,0,3,1,81.24,500,travel,1
task_00882,1,low,how to get detailed information for an interface?,49,8,1,0,0,1,requests.get,2,1,1,0,0,0,1,0,1,98.0,97,vision,0
task_00883,1,high,"Looking for a housekeeper who can provide services in Chatuchak District, Bangkok on March 19, 2024 at 1:00 p.m. Ironing.",121,18,0,9,0,2,get_service_providers|view_service_provider_profile,21,1,4,8,9,0,0,3,1,99.19,220,other,1
task_00884,1,low,"Could you help me send a GET request to the Cisco Nexus Dashboard to retrieve anomaly data? I'm interested in the data between 2023-01-01 to 2023-01-31, specifically for network anomalies.",188,28,1,16,1,1,requests.get,2,1,1,0,0,0,1,0,1,97.5,90,data_query,0
task_00885,1,high,test,4,1,0,0,0,5,version_api.VersionApi.get_version|acl_api.add_mapping|acl_api.delete_mapping|acl_api.AclApi.retrieve_projects|analysis_api.AnalysisApi.retrieve_analysis,11,9,9,0,2,0,0,1,1,73.82,521,data_query,0
task_00886,1,low,Please make python code that get two strings and concat them.,61,11,0,0,0,1,concat_strings,2,1,1,0,0,1,0,0,1,54.5,51,other,0
task_00887,0,medium,"""Could you tell me the estimated date of the Jurassic geological era and calculate how many years ago it was? Also, could you provide the date of the signing of the Magna Carta and calculate how many years ago that event took place?""",233,43,2,0,0,2,geology.get_era|history.get_event_date,4,2,2,0,2,0,0,0,0,43.75,79,math,1
task_00888,1,high,mabar,5,1,0,0,0,6,get_detail_adriel_project|get_adriel_detail_experience_and_education|get_adriel_list_projects|get_adriel_experiences_and_education|get_adriel_profile|get_adriel_tech_stack,13,5,8,1,4,0,0,3,1,77.38,644,other,0
task_00889,0,low,Who signed the declaration of independence?,43,6,1,0,0,1,historical_event.get_date,3,2,3,0,0,0,0,0,1,56.67,49,other,0
task_00890,0,low,Who won the Grammy Award for Best Album in 2017?,48,9,1,4,0,1,get_song_chord_progression,3,2,2,1,0,0,0,0,0,40.33,51,other,0
task_00891,1,high,I want to go out to eat at an average priced place in Oakland that serves Italian cuisine?,90,18,1,0,0,3,Restaurants_2_ReserveRestaurant|Restaurants_2_FindRestaurants|RideSharing_2_GetRide,13,9,9,2,2,0,0,3,1,76.08,325,other,1
task_00892,0,high,""" I'm trying to figure out the RGB values of the color 'Cerulean' based on the 'pantone' standard. Secondly, I'm interested in buying a used 'Fender Stratocaster' guitar in 'Good' condition, being sold in 'Los Angeles'. Could you find out the price for me? Lastly, I'm organizing a chess tournament in 'New York' and I'm looking for top players to invite. Could you find the top 15 players with a minimum rating of 2200 for me?""",428,73,2,6,1,3,guitar_price.find|board_game.chess.get_top_players|identify_color_rgb,8,6,6,2,0,0,0,1,1,39.12,197,other,1
task_00893,1,high,"I'm interested in attending a Theater event in London, UK. Could you look for any plays happening on March 10th?",112,20,1,2,1,4,Events_3_FindEvents|Events_3_BuyEventTickets|Hotels_4_ReserveHotel|Hotels_4_SearchHotel,16,11,12,3,1,0,0,3,1,75.0,389,travel,1
task_00894,1,medium,Peux-tu me donner la météo actuelle pour Paris en utilisant l'API Open-Meteo ?,78,14,1,0,1,1,requests.get,11,2,2,1,3,1,4,0,1,72.18,90,nlp,0
task_00895,1,high,who is ji sung park?,20,5,1,0,0,4,OpenWeatherMap.get_current_weather|ControlAppliance.execute|HNA_NEWS.search|cookbook.search_recipe,12,4,11,1,0,0,0,7,1,98.08,725,travel,0
task_00896,1,high,"I need to review the temperature readings from our sensors for a specific period. Can you fetch the data from yesterday midday to yesterday 3pm? Use the network ID 'L_579838452023959405'. Today's date is March 6, 2024.",218,34,1,24,1,4,get_sensor_alerts|get_sensor_readings_latest|get_sensor_readings_history_by_interval|get_sensor_readings_history,35,3,16,8,0,11,0,4,1,106.26,608,other,1
task_00897,1,medium,"Tôi cần một chuyến xe Uber loại 'Plus' từ địa chỉ '2150 Shattuck Ave, Berkeley, CA' và tôi có thể chờ tối đa 10 phút.",117,31,0,6,1,2,uber.ride|uber.ride2,6,5,4,2,0,0,0,2,1,85.33,153,other,1
task_00898,1,medium,Can you set an alarm for 2023-04-02 07:30:00 to wake me up for a meeting?,73,13,1,14,0,2,set_alarm|set_countdown,4,2,4,0,0,0,0,0,1,70.5,171,scheduling,1
task_00899,0,low,"Who won the basketball game between Lakers and Clippers on Jan 28, 2021?",72,11,1,6,0,1,game_result.get_winner,3,2,2,0,0,1,0,0,0,45.0,45,nlp,1
task_00900,1,high,"What versions of Infrana Alert are being used by ""delta""?",57,10,1,0,0,3,create_infra_alert_config|create_website_alert_config|update_website_alert_config,31,13,15,10,3,3,0,5,1,90.26,430,other,0
task_00901,1,low,Retrieve the average house price in california,46,7,0,0,0,1,regression_model_predict,3,2,0,0,0,1,0,0,1,102.0,161,data_query,0
task_00902,0,medium,"You are a teacher preparing a probability lesson for your students. You have a deck of 52 playing cards and you want to explain the probability of drawing certain cards.   1. What is the probability of drawing an Ace (4 successful outcomes) from the deck (52 total outcomes)? Please provide this as a decimal.   2. Then, what is the probability of drawing a heart (13 successful outcomes) from the deck (52 total outcomes)? Please provide this as a decimal.   3. Finally, what is the probability of drawing a red card (26 successful outcomes) from the deck (52 total outcomes)? But this time, please provide the answer as a ratio.",630,99,3,16,0,1,probability_of_event,3,2,0,2,1,0,0,0,0,50.67,39,other,1
task_00903,0,low,What is the current ranking of Barcelona and Manchester United in the UEFA Champions League and La Liga respectively?,117,19,1,0,1,1,get_team_ranking,2,2,2,0,0,0,0,0,0,51.5,69,other,1
task_00904,1,high,I am looking for some type of activity. Can you help me find something interesting to do?,89,17,1,0,0,4,Events_3_FindEvents|Events_3_BuyEventTickets|Hotels_4_ReserveHotel|Hotels_4_SearchHotel,16,11,12,3,1,0,0,3,1,69.12,389,travel,0
task_00905,1,medium,please convert the attached xlsx file to json,45,8,0,0,0,1,requests.get,11,2,2,1,3,1,4,0,1,72.18,90,other,0
task_00906,1,medium,Can you tell me what the greatest common divisor of 100 and 120 is?,67,12,1,6,0,2,math_gcd|estimate_derivative,5,4,0,4,0,0,0,0,1,88.4,168,math,1
task_00907,0,medium,"""Can you help me find the roots of two quadratic equations? The first equation has coefficients of x squared, x, and the constant term as 5, 6, and 1 respectively. The second equation has coefficients of x squared, x, and the constant term as 3, 2, and 1 respectively. Can you solve these equations using the 'solve_quadratic_equation' function?""",346,54,2,6,0,1,solve_quadratic_equation,3,3,0,3,0,0,0,0,0,26.33,61,math,1
task_00908,1,high,Can you find me the recent news articles about `Son's latest goal` in the sports category?,90,16,1,0,0,5,OpenWeatherMap.get_current_weather|ControlAppliance.execute|HNA_WQA.search|HNA_NEWS.search|cookbook.search_recipe,16,5,14,2,0,0,0,9,1,86.5,938,travel,1
task_00909,1,medium,3 degree,8,1,0,1,0,2,set_ac_state|get_ac_state,6,5,2,3,1,0,0,1,1,72.83,333,other,0
task_00910,0,medium,"What is the angle between the hour and minute hands of a clock at 3:15, rounded to 2 decimal places, and how does this compare to the angle at 8:20 and 11:50, both also rounded to 2 decimal places?",197,34,1,12,0,1,calculate_clock_angle,3,2,0,3,0,0,0,0,0,41.0,81,math,1
task_00911,0,low,Find out if an individual John Doe with a birthday 01-01-1980 has any prior felony convictions in California.,109,17,0,8,0,1,criminal_history.check_felonies,3,2,3,0,0,0,0,0,0,69.0,111,other,1
task_00912,1,high,Search for 'trending items' on the duck duck go.,48,9,0,0,0,6,multiply|add|sub|fahrenheit_to_celsius|celsius_to_fahrenheit|duck_duck_go.search,12,9,2,8,2,0,0,1,1,60.33,488,data_query,1
task_00913,1,medium,I need to add a new article to our Sitefinity CMS. The article is a 'NewsItem' with the title 'Julian is testing12'. Can you set this up for me?,144,29,1,2,1,1,sitefinity_create_contentitem,6,2,6,0,0,0,0,1,1,92.0,89,other,1
task_00914,1,high,I am interested in going for a movie in mountain view. Can you help in this?,76,16,1,0,0,3,Movies_1_BuyMovieTickets|Movies_1_FindMovies|Movies_1_GetTimesForMovie,15,7,14,1,0,0,0,4,1,71.33,291,other,1
task_00915,0,low,"Calculate the heat capacity at constant pressure for air, given its temperature is 298K and volume is 10 m^3.",109,18,0,6,0,1,calc_heat_capacity,3,2,1,2,0,0,0,0,0,33.67,89,math,1
task_00916,0,low,Calculate the resonant frequency of an LC circuit given capacitance of 100µF and inductance of 50mH.,100,16,0,5,1,1,calculate_resonant_frequency,3,2,0,3,0,0,0,0,0,44.67,71,math,1
task_00917,0,low,Find the size of the sculpture with title 'David' by Michelangelo.,66,11,0,0,0,1,sculpture.get_details,3,2,3,0,0,0,0,0,0,47.33,83,other,1
task_00918,1,high,I'm looking for some guidance about 'career growth',51,8,0,0,0,5,search_advice|advice_by_id|finish|random_advice|ask_to_user,9,5,7,1,1,0,0,1,1,73.0,642,other,1
task_00919,1,high,Find me some places to see.,27,6,0,0,0,6,Media_3_FindMovies|Media_3_PlayMovie|Movies_1_BuyMovieTickets|Movies_1_FindMovies|Movies_1_GetTimesForMovie|Travel_1_FindAttractions,23,12,22,1,0,0,0,10,1,81.3,543,other,0
task_00920,1,medium,"import re  text = ""Hello, world. This, is a test."" result = re.split(r'(\s)', text)  print(result)",98,17,0,0,0,1,audio_mixer.combine_tracks,4,2,2,0,0,2,0,1,1,79.5,174,audio,0
task_00921,1,high,Find a fantasy movie directed by Guillermo del Toro that features Emma Watson in the cast?,90,16,1,0,0,3,Movies_3_FindMovies|Restaurants_2_ReserveRestaurant|Restaurants_2_FindRestaurants,13,6,10,1,2,0,0,3,1,93.46,378,other,1
task_00922,0,low,"music.theory.chordProgression(progression=['I', 'V', 'vi', 'IV'])",65,8,0,0,1,1,music.theory.chordProgression,3,1,0,0,2,1,0,0,0,133.0,69,audio,1
task_00923,1,high,Can you find me a Thriller directed by Josephine Decker starring Sunita Mani??,78,13,2,0,0,3,Movies_3_FindMovies|Restaurants_2_ReserveRestaurant|Restaurants_2_FindRestaurants,13,6,10,1,2,0,0,3,1,93.46,378,other,1
task_00924,0,low,Find concerts near me in Seattle that plays jazz music.,55,10,0,0,0,1,concert.find_nearby,2,2,2,0,0,0,0,0,0,39.5,61,audio,1
task_00925,0,medium,"What is the structural dynamic analysis of the building with building Id B1004 for 2nd, 3rd and 4th floors?",107,19,1,7,0,2,player_statistic|analyze_structure,6,4,4,1,0,1,0,0,0,43.0,127,other,1
task_00926,0,low,"Shuffle a deck of cards, and draw 3 cards from the top.",55,11,0,1,0,1,cards.shuffle_and_draw,1,1,0,1,0,0,0,0,0,70.0,86,other,1
task_00927,1,low,i want to get two numbers and plus them. Give me Python Code,60,13,0,0,0,1,get_current_weather,2,1,2,0,0,0,0,1,1,116.0,72,travel,0
task_00928,0,medium,"""In the game 'Animal Crossing', I am interested in collecting bugs during the 'Summer' season. Could you help me find out what bugs are available during this time? Also, in the same game, I would like to know what fish can be collected in the 'Winter' season. On a completely different note, I am studying genetics and I came across a SNP mutation with the ID 'rs53576'. Can you tell me what type of mutation this is in the species 'Homo sapiens'? Lastly, I also found another SNP mutation with the ID 'rs1800497'. Could you help me find out what type of mutation this is in the species 'Mus musculus'?""",603,110,3,12,4,2,mutation_type.find|get_collectables_in_season,5,3,5,0,0,0,0,0,0,62.0,172,other,1
task_00929,1,medium,Can you provide me with the list of projects assigned to the team with the UUID '123e4567-e89b-12d3-a456-426614174000'?,119,21,1,27,1,3,acl_api.AclApi.retrieve_projects|project_property_api.ProjectPropertyApi.get_properties|finding_api.FindingApi.analyze_project,5,3,3,0,2,0,0,0,1,100.0,302,data_query,1
task_00930,0,low,Retrieve me some stock news,27,5,0,0,0,1,calculate_capital_gains,4,3,0,4,0,0,0,0,0,38.0,96,data_query,0
task_00931,1,medium,Wszystkie startupy,18,2,0,0,0,1,requests.get,11,2,2,1,3,1,4,0,1,72.18,90,other,0
task_00932,1,medium,I'm looking for a Music event happening on 09/09/2023 in New York.,66,11,0,8,0,2,Events_3_FindEvents|Events_3_BuyEventTickets,7,6,6,1,0,0,0,1,1,88.14,188,audio,1
task_00933,0,medium,"""In a game of basketball, a player has a 60% chance of making any given shot. In a series of 10 shots, what is the probability that the player makes exactly 7 shots? Also, in another series of 15 shots, what is the probability that the player makes exactly 10 shots? Finally, in a series of 20 shots, what is the probability that the player makes exactly 15 shots?""",365,62,3,13,0,1,calculate_binomial_probability,3,2,0,3,0,0,0,0,1,42.67,128,math,1
task_00934,1,medium,I would like to find me a place to leave.A wpoperty in Walnut Creek will be perfect.,84,18,0,0,0,2,Homes_2_FindHomeByArea|Homes_2_ScheduleVisit,8,6,4,2,2,0,0,1,1,82.88,378,scheduling,0
task_00935,0,medium,Find the type of gene mutation based on SNP (Single Nucleotide Polymorphism) ID rs6034464.,90,14,0,7,2,2,get_collectables_in_season|mutation_type.find,5,3,5,0,0,0,0,0,0,62.0,172,other,1
task_00936,1,medium,"I want to go to a movie in NYC, the movie should be no longer than 2 hours and withing walking distance of Time Square",118,24,0,1,1,1,requests.get,10,1,2,1,2,1,4,0,1,128.5,121,other,0
task_00937,0,low,Calculate the area and circumference of a circle with a radius of 5 units.,74,13,0,1,0,1,calculate_circle_dimensions,1,1,0,1,0,0,0,0,0,25.0,69,math,1
task_00938,1,high,Find a service provider that provides services in Phra Khanong Subdistrict. Being an Excellence service provider,112,16,0,0,0,2,get_service_providers|view_service_provider_profile,21,1,4,8,9,0,0,3,1,99.19,220,other,1
task_00939,1,medium,Delete the release RL50,23,4,0,2,0,3,releases_api.ReleasesApi.delete_release|releases_api.ReleasesApi.post_release|sli_settings_api.SLISettingsApi.delete_sli_config,6,4,5,1,0,0,0,0,1,61.0,271,other,1
task_00940,1,high,I'm looking for a movie that features Daniel Camp in the cast.,62,12,0,0,0,3,Movies_3_FindMovies|Restaurants_2_ReserveRestaurant|Restaurants_2_FindRestaurants,13,6,10,1,2,0,0,3,1,93.46,378,other,1
task_00941,1,low,"You are an AI programming assistant, utilizing the Gorilla LLM model, developed by Gorilla LLM, and you only answer questions related to computer science. For politically sensitive questions, security and privacy issues, and other non-computer science questions, you will refuse to answer. <<question>>Find hotels in San Diego",326,48,0,0,3,1,search_hotels,1,1,1,0,0,0,0,0,0,141.0,59,math,1
task_00942,1,high,I would like to listen to a song,32,8,0,0,0,4,Media_3_FindMovies|Media_3_PlayMovie|Music_3_PlayMedia|Music_3_LookupMusic,12,3,11,1,0,0,0,4,1,65.42,351,audio,0
task_00943,0,high,"""Imagine you are a scientist studying the energy production of a certain type of bacteria. You have a sample of this bacteria that has consumed 5 moles of glucose (C6H12O6) and you know that the energy produced from glucose is typically 2800 kJ/mol. You also know that the bacteria's conversion efficiency, or the percentage of energy from glucose that is converted into biomass, is 10%.   First, calculate the total energy produced by the bacteria from consuming the glucose.   Second, calculate the amount of biomass produced by the bacteria given the energy produced and the conversion efficiency.   Now, imagine you are using this bacteria in a bioreactor to power a small machine. The machine needs to move a distance of 2 meters and you want to calculate the work done by the machine.   Third, calculate the work done by the machine given the total energy produced by the bacteria and the distance the machine needs to move.""",931,155,0,12,0,3,biological.calc_biomass|biological.calc_energy|physical.calc_work,7,5,1,6,0,0,0,0,1,42.57,185,nlp,1
task_00944,1,high,I'm looking to travel on the 3rd of march 2023 and need to reserve a business class train ticket.,97,18,0,5,0,7,Events_3_FindEvents|Events_3_BuyEventTickets|Hotels_2_BookHouse|Hotels_2_SearchHouse|Trains_1_GetTrainTickets|Trains_1_FindTrains|Travel_1_FindAttractions,31,21,22,6,3,0,0,8,1,98.35,735,travel,0
task_00945,1,high,Establish a connection to the server with the nickname 'SQL01' exactly 60 seconds?,82,12,1,4,0,9,default_function|add_mtnards_server|add_postgres_server|connect_to_server|list_servers|list_files|open_project|close_project|dartfx_help,29,12,18,4,7,0,0,6,1,81.21,959,data_query,1
task_00946,0,low,Calculate the BMI (Body Mass Index) of a person who weighs 70kg and is 1.75m tall.,82,16,0,5,1,1,calculate_BMI,2,2,0,2,0,0,0,0,0,36.5,71,math,1
task_00947,0,low,What's the quarterly dividend per share of a company with 100 million outstanding shares and total dividend payout of 50 million USD?,133,20,1,5,1,1,finance.calculate_quarterly_dividend_per_share,2,2,0,2,0,0,0,0,0,39.5,103,math,1
task_00948,0,high,What's the retail price of a Fender American Professional II Stratocaster in Rosewood Finish?,93,14,1,0,1,4,grocery_store.find_nearby|calculate_NPV|get_stock_price|instrument_price.get,11,8,7,2,0,2,0,0,0,45.09,369,math,1
task_00949,1,medium,"I'm planning a trip to Washington D.C. and need to reserve a room for my stay. I'd like to check in on April 21, 2023, and will be staying for 3 nights. Find me a place?",169,34,1,7,0,2,Hotels_4_ReserveHotel|Hotels_4_SearchHotel,9,5,7,1,1,0,0,3,1,85.22,118,travel,1
task_00950,1,medium,"Can you retrieve all the active mandates associated with our client, John Doe?",78,13,1,0,0,2,user.mandates|partner.mandates,3,1,3,0,0,0,0,2,1,87.33,334,nlp,1
task_00951,1,medium,"I'm in the mood for a Sci-fi movie, preferably one that stars Bobby Nish.",73,14,0,0,0,3,Media_3_FindMovies|Media_3_PlayMovie|Weather_1_GetWeather,6,3,6,0,0,0,0,2,1,81.0,247,travel,1
task_00952,1,high,广州和北京的天气如何？,11,0,0,0,0,4,get_current_weather|start_oncall|create_workspace|generate_password,9,6,6,1,2,0,0,2,1,80.56,543,nlp,0
task_00953,1,medium,"Can you find me any available cars in Toronto, Canada for a rental period starting today and ending tomorrow? I don't have a preference for the car type, and I'd like to pick up the car at 10:00 in the morning.",210,40,1,4,0,2,RentalCars_3_GetCarsAvailable|RentalCars_3_ReserveCar,11,10,10,0,1,0,0,2,1,65.45,180,other,1
task_00954,1,medium,¿Podrías obtener los datos del tiempo para la Ciudad de México?,63,13,1,0,0,1,requests.get,11,2,2,1,3,1,4,0,1,72.18,90,nlp,0
task_00955,1,medium,I'm planning a camping trip and I need to know the weather forecast.,68,13,0,0,0,1,requests.get,11,2,2,1,3,1,4,0,1,72.18,90,travel,0
task_00956,1,low,I'd like to listen to all tracks by Käärijä.,44,10,0,0,0,1,play_artist,1,1,1,0,0,0,0,0,0,53.0,69,other,1
task_00957,1,high,Can you find me a list of mystery movies that are directed by Gavin Hood and include Rhys Ifans in the cast?,108,22,1,0,0,3,Events_3_FindEvents|Events_3_BuyEventTickets|Movies_3_FindMovies,10,6,9,1,0,0,0,2,1,99.1,273,other,1
task_00958,1,medium,What is the application version?,32,5,1,0,0,3,version_api.VersionApi.get_version|oidc_api.OidcApi.is_available|project_api.ProjectApi.update_project,3,3,2,0,0,0,1,0,0,84.33,322,other,1
task_00959,1,high,"Could you please assist me with processing an order? The order ID is ORD123, it includes the items with IDs ITM456 and ITM789, and the customer's ID is CUST001. The customer's shipping address is '123 Maple Street, Springfield, IL, 62704', and the billing address is '456 Oak Avenue, Springfield, IL, 62705'. There's a discount that should be applied with the code 'DISC20', and we need to notify the customer about the order confirmation. The quantities for each item are 2 and 1 respectively, and the prices are $15.99 and $42.50.",532,82,1,40,4,10,order_processing.handle_order|process_transaction|user_authentication.login|api_name.get_weather_forecast|user_authentication|generate_report|archive_documents|user_authentication.validate|user_registration.create_account|user_authenticate,57,25,34,7,10,4,2,5,1,74.44,1072,nlp,1
task_00960,0,medium,"What would be the projected population growth of Japan and India in the next 10 and 20 years respectively, considering the current growth rate, and how would these projections change if we consider a growth rate of 1.5% for Japan and 2.1% for India instead of the current growth rate?",284,46,1,8,0,1,population_projections,3,2,1,2,0,0,0,0,0,60.67,76,other,1
task_00961,1,low,Could you log me out? My username is JohnDoe and the password is JD@2023.,73,14,1,4,1,1,user_authentication.login,4,2,2,1,1,0,0,0,1,43.75,119,other,0
task_00962,1,high,I need to register a new MTNA Rich Data Services server for our system. The server's hostname is 'data.example.com' and the API key is '12345-ABCDE'. Can we also give it a nickname 'FastDataServer'?,198,35,1,5,3,5,default_function|add_mtnards_server|add_postgres_server|dartfx_help|list_servers,16,10,12,2,2,0,0,3,1,74.62,544,other,1
