task_uid,is_live_benchmark,task_complexity,query,query_char_length,query_word_count,query_question_marks,query_digit_count,query_uppercase_words,num_available_tools,tool_names,total_params,total_required_params,num_string_params,num_numeric_params,num_boolean_params,num_array_params,num_object_params,num_enum_params,has_default_values,avg_param_description_length,tool_description_total_length,task_domain,can_answer
task_02579,0,low,Calculate the circumference of a circle with radius 3,53,8,0,1,0,1,geometry.circumference,2,1,1,1,0,0,0,0,0,44.5,57,math,1
task_02580,0,medium,Search for divorce law specialists in Los Angeles,49,8,0,0,0,2,doctor.search|lawyer.search,4,4,4,0,0,0,0,0,0,58.0,118,data_query,1
task_02581,0,low,What is the final velocity of a vehicle that started from rest and accelerated at 4 m/s^2 for a distance of 300 meters?,119,22,1,5,0,1,kinematics.final_velocity_from_distance,3,2,0,3,0,0,0,0,0,39.33,120,other,1
task_02582,1,high,Can you retrieve a list of Electropop songs that include tracks by Tove Lo?,75,14,1,0,0,6,Alarm_1_GetAlarms|Alarm_1_AddAlarm|Media_3_FindMovies|Media_3_PlayMovie|Music_3_PlayMedia|Music_3_LookupMusic,17,5,16,0,1,0,0,5,1,73.35,555,audio,1
task_02583,1,medium,"Tôi cần một chuyến Uber loại 'Plus' từ địa chỉ 123 Đường Đại học, Berkeley, CA 94704 và tôi không muốn chờ quá 10 phút.",119,32,0,10,1,1,uber.ride,3,3,2,1,0,0,0,1,0,84.33,130,other,1
task_02584,1,high,Find me some attractions to visit,33,6,0,0,0,5,Messaging_1_ShareLocation|RentalCars_3_GetCarsAvailable|RentalCars_3_ReserveCar|Travel_1_FindAttractions|get_current_weather,19,14,18,0,1,0,0,6,1,79.16,598,travel,0
task_02585,1,high,Find movie to watch at AMC theater Saratoga this weekend? I'm open to any genre.,80,15,1,0,1,5,Movies_1_BuyMovieTickets|Movies_1_FindMovies|Movies_1_GetTimesForMovie|Music_3_PlayMedia|Music_3_LookupMusic,23,10,22,1,0,0,0,8,1,81.91,407,audio,1
task_02586,1,high,```bash,7,1,0,0,0,6,product_list.retrieve|get_business_unit_mapping|product_selector.get_products|sce_api.get_products|product_volume.get_active_branches|sce_api.get_product_information,11,4,7,3,1,0,0,4,1,114.91,718,data_query,0
task_02587,1,low,"请帮我生成一组多轮对话数据,里面包含了LLM function call",36,3,0,0,0,1,get_current_weather,2,1,2,0,0,0,0,1,1,116.0,72,travel,0
task_02588,1,medium,Can you help me find a bus.,27,7,0,0,0,2,Buses_3_FindBus|Buses_3_BuyBusTicket,11,7,8,2,1,0,0,2,1,66.0,249,other,0
task_02589,1,high,weather in India using searcvh web tool,39,7,0,0,0,6,generate_image_tool|tts_tool|write_markdown_tool|write_html_tool|search_web_tool|get_url_content,15,7,13,2,0,0,0,2,1,98.8,1271,vision,1
task_02590,0,high,"Book a luxury room in Hotel Paradise, Las Vegas, with a city view for 3 days starting from May 12, 2022.",104,18,0,7,0,4,random.normalvariate|get_personality_traits|elephant_population_estimate|book_hotel,13,11,6,6,0,1,0,0,1,43.15,337,travel,1
task_02591,1,low,Who are you?,12,3,1,0,0,1,get_current_weather,2,1,2,0,0,0,0,1,1,116.0,72,travel,0
task_02592,1,medium,Order 5 fries from uber eats mc donalds,39,7,0,1,0,2,uber.eat.order|flight.status.check,8,6,6,0,0,2,0,1,1,62.38,207,travel,1
task_02593,0,low,What is the average weight of a human brain?,44,9,1,0,0,1,get_neural_activity,4,3,3,0,1,0,0,0,1,44.75,56,other,0
task_02594,1,medium,What's 2*2?,11,1,1,2,0,1,requests.get,11,1,2,1,3,1,4,0,1,93.55,91,other,0
task_02595,1,medium,could you show me nsdq index in past 2 months,45,9,0,1,0,1,requests.get,11,2,2,1,3,1,4,0,1,72.18,90,other,0
task_02596,1,medium,"hola como estas, como te llamas?",32,6,1,0,0,2,get_current_weather|get_n_day_weather_forecast,5,3,4,1,0,0,0,2,1,99.2,215,travel,0
task_02597,0,low,What color should I use to get a similar color of blue in my painting?,70,15,1,0,0,1,color_complimentary,2,1,2,0,0,0,0,0,1,60.5,99,other,0
task_02598,1,low,"Could you tell me the current weather forecast for Alpharetta, GA, with measurements?",85,13,1,0,1,1,get_weather_forecast,4,2,3,0,1,0,0,0,1,125.5,118,travel,0
task_02599,1,medium,Kak tambah lg dong stock yg white nya 🥲🥲,40,8,0,0,0,2,search_products|get_product_details,12,2,9,2,1,0,0,1,1,98.17,309,finance,0
task_02600,0,medium,"Analyze the performance of the L.A Lakers in their last game and give me the field goal percentage and free throw percentage. Also, compare the team's points per game (ppg) average from 2018-2019 and 2019-2020 season.",217,35,0,16,0,2,sport_analysis.last_game_performance|sport_analysis.compare_ppg,4,4,2,0,0,2,0,0,0,46.5,125,other,1
task_02601,1,medium,I need to review the investment activities of Berkshire Hathaway. Retrieve their 13F-HR filings and their CIK number is 0001067983.,131,19,0,12,2,2,holdings.get_13F_HR|quarterly_earnings,4,4,4,0,0,0,0,0,0,97.75,312,data_query,1
task_02602,0,medium,"Calculate the final velocity of a moving object given initial velocity of 20 m/s, acceleration of 5 m/s^2 and time of 6 seconds. Also, compute the total distance covered by the object.",184,31,0,5,0,2,kinematics.distance_traveled|kinematics.final_velocity,6,6,0,6,0,0,0,0,0,46.33,196,math,1
task_02603,1,medium,what's the color of the sea?,28,6,1,0,0,1,create_user_profile,6,2,3,1,1,0,1,0,1,73.17,146,other,0
task_02604,1,high,Hello! Could you help me select a date for my vacation? I'm thinking of flying out on the 20th of september 2023.,113,21,1,6,0,4,render_ui_single_select_widget|render_ui_multi_select_widget|render_ui_date_picker_widget|render_ui_finish,8,6,4,0,1,3,0,0,1,90.88,413,other,1
task_02605,1,medium,"Sort this list of names in ascending order: ['Sam', 'Alice', 'Jack'].  First, identify the appropriate function.",112,16,0,0,0,3,sort_list|filter_list|sum_elements,6,4,3,0,0,3,0,2,1,91.17,238,other,1
task_02606,1,low,5A景区,4,1,0,1,0,1,query_amap_info,5,1,3,1,1,0,0,1,1,66.2,92,other,0
task_02607,1,high,"My package has arrived, I ordered size UK 34 but why is it different from the size 34 pants I bought from here before? There's a difference of ±5cm, so the new one doesn't fit me.",179,34,1,5,1,4,inventory_management|product_search|order_status_check|get_product_details,11,5,10,0,0,1,0,3,1,82.45,436,other,0
task_02608,0,low,Who discovered electricity?,27,3,1,0,0,1,calculate_electric_current,3,2,0,3,0,0,0,0,0,58.33,80,math,0
task_02609,0,low,What is the best chess move for white player in this position?,62,12,1,0,0,1,fetch_game_stats,3,2,2,1,0,0,0,0,1,43.67,79,other,0
task_02610,1,low,"Can you arrange a flight for me departing from New York on the 15th of March, 2024?",83,16,1,6,0,1,book_flight,2,2,2,0,0,0,0,0,0,126.5,75,travel,1
task_02611,1,medium,who is shashi tej reddy,23,5,0,0,0,1,compute_tax,6,3,2,4,0,0,0,2,1,93.33,158,math,0
task_02612,1,low,open huggingface using the start command and through the link: https://huggingface.co,85,13,0,0,0,1,cmd_controller.execute,2,1,2,0,0,0,0,1,1,106.5,141,vision,1
task_02613,1,low,"Could you analyze the image at http://www.thewowstyle.com/wp-content/uploads/2015/01/Home-Interior-Design-Hd-Wallpaper-Hd-Background-With-Simple-Staircase-And-Plasma-TV-Also-Nice-Laminate-Flooring-Ideas-With-Modern-Furniture-Interior-Minimalist-Design.jpg and provide a detailed description based on the question, 'How does the arrangement of furniture contribute to the minimalist design of the interior?'",406,37,1,6,1,1,pipeline,2,2,2,0,0,0,0,0,0,113.0,119,vision,1
task_02614,1,medium,"As an admin, I'd like to review the access log entries starting from the first record. Could you provide me with the first 50 entries?",134,24,1,2,0,3,audit_log_api.AuditLogApi.get_access_logs|audit_log_api.AuditLogApi.get_audit_logs|CustomDashboardsApi.get_shareable_api_tokens,6,3,2,4,0,0,0,0,1,98.67,452,other,1
task_02615,0,medium,"""Could you please calculate the future value of my investments? I have invested $5000 in Apple Inc. (AAPL) and expect an annual return of 7% over the next 5 years. I have also invested $8000 in Microsoft Corporation (MSFT) with an expected annual return of 6% for the next 7 years. Lastly, I have invested $10000 in Amazon.com, Inc. (AMZN) expecting an annual return of 8% for the next 10 years.""",396,63,1,20,3,1,portfolio_future_value,4,4,1,3,0,0,0,0,0,45.0,137,math,1
task_02616,1,low,"what is the date, using the date or echo command",48,10,0,0,0,1,cmd_controller.execute,2,1,2,0,0,0,0,1,1,106.5,141,other,1
task_02617,1,medium,Find a list of ghost movies directed by Peter Strickland?,57,10,1,0,0,3,Events_3_FindEvents|Events_3_BuyEventTickets|Movies_3_FindMovies,10,6,9,1,0,0,0,2,1,99.1,273,other,1
task_02618,1,high,I'll be in Los Angeles on March 10th. Can you look up any music events happening on that date?,94,19,1,2,0,4,Events_3_FindEvents|Events_3_BuyEventTickets|Hotels_4_ReserveHotel|Hotels_4_SearchHotel,16,11,12,3,1,0,0,3,1,75.0,389,audio,1
task_02619,1,medium,天气如何？,5,0,0,0,0,2,get_current_weather|weather_forecast.get,5,3,5,0,0,0,0,2,1,85.2,134,travel,0
task_02620,1,medium,"I'm finding it difficult to keep track of my meetings, so I'd like to set up some additional reminders. Could you check which alarms are already set for my user ID 789?",168,31,1,3,1,2,Alarm_1_GetAlarms|Alarm_1_AddAlarm,5,2,3,1,1,0,0,1,1,52.8,148,scheduling,1
task_02621,0,medium,What will be the air quality index of New York for the next week?,65,14,1,0,0,3,air_quality_forecast|weather_forecast|news,6,6,3,3,0,0,0,0,0,44.0,183,travel,1
task_02622,0,low,"Find me the 5 tallest mountains within 50km of Denver, Colorado.",64,10,0,3,0,1,locate_tallest_mountains,3,3,1,2,0,0,0,0,0,57.67,67,other,1
task_02623,1,medium,Could you retrieve the current weather data?,44,7,1,0,0,1,requests.get,11,2,2,1,3,1,4,0,1,72.18,90,data_query,0
task_02624,1,low,"help me send a nice message to my husband, Jeff? My name is Emily.",66,14,1,0,0,1,greet_partner,3,2,3,0,0,0,0,1,1,50.33,56,nlp,1
task_02625,1,high,I want to see a movie with Zoe Margaret Colletti in it.,55,12,0,0,0,3,Movies_3_FindMovies|Restaurants_2_ReserveRestaurant|Restaurants_2_FindRestaurants,13,6,10,1,2,0,0,3,1,93.46,378,other,1
task_02626,0,medium,Who were the main participants and what was the location of the Battle of Stalingrad?,85,15,1,0,0,3,european_history.war_details|european_history.leader_info|european_history.battle_details,3,3,3,0,0,0,0,0,0,17.0,174,other,1
task_02627,0,medium,"Calculate the Greatest Common Divisor (GCD) of 96 and 128, and the least common multiple (LCM) of 15 and 25.",108,16,0,9,2,3,primeFactors|lcm|gcd,6,5,0,5,1,0,0,0,1,22.67,143,math,1
task_02628,1,medium,"I am a chatbot and I'd like to return correct responses to my users based on their intent. Given a query, help me recognize the right intent from a pre-defined list of intents: [ get_balance, transfer_funds, hello, goodbye ].  Query: show me my balance.",253,44,0,0,0,1,get_response,4,1,2,1,0,0,1,1,1,92.0,68,nlp,0
task_02629,1,medium,interviewers for python,23,3,0,0,0,2,get_interviewer_list|review_of_interviewer,5,2,3,0,2,0,0,1,1,69.6,173,other,1
task_02630,0,low,Get current Gold price per ounce.,33,6,0,0,0,1,get_metal_price,2,2,2,0,0,0,0,0,0,45.5,61,other,1
task_02631,0,low,What type of rock is the most suitable for creating a garden sculpture?,71,13,1,0,0,1,sculpture.create,3,2,3,0,0,0,0,0,0,50.0,50,other,0
task_02632,0,low,Calculate the required water daily intake for a person with weight 70 kg.,73,12,0,2,0,1,calculate_daily_water_intake,3,1,2,1,0,0,0,0,0,59.0,80,math,1
task_02633,1,high,test,4,1,0,0,0,7,detail_adriel_project|adriel_detail_experience_and_education|adriel_list_projects|adriel_experiences_and_education|adriel_contact|adriel_tech_stack|help,13,4,9,1,3,0,0,4,1,75.0,855,other,0
task_02634,0,low,Who played in La Liga?,22,5,1,0,0,1,soccer_stats.get_last_match_result,3,2,3,0,0,0,0,0,0,38.67,73,other,0
task_02635,1,medium,Whats the weather like in San Francisco,39,7,0,0,0,3,getCurrentTime|CalcProduct|sum,6,4,1,4,1,0,0,0,1,77.83,130,travel,0
task_02636,1,high,I need to make a payment using app balance to Peter $75.50?,59,11,1,4,0,5,Payment_1_RequestPayment|Payment_1_MakePayment|Trains_1_GetTrainTickets|Trains_1_FindTrains|Weather_1_GetWeather,21,14,14,4,3,0,0,3,1,81.24,500,travel,1
task_02637,1,high,AI가 뭐야,6,1,0,0,0,4,OpenWeatherMap.get_current_weather|ControlAppliance.execute|HNA_NEWS.search|cookbook.search_recipe,12,4,11,1,0,0,0,7,1,98.08,725,travel,0
task_02638,1,medium,Find me a Horror movie that features Christopher Lee?,53,9,1,0,0,3,Media_3_FindMovies|Media_3_PlayMovie|Weather_1_GetWeather,6,3,6,0,0,0,0,2,1,81.0,247,travel,1
task_02639,1,low,Mau konfirm yg celana seemless nya nga ada tiga2,48,9,0,1,0,1,user_authentication.login,4,2,2,1,1,0,0,0,1,43.75,119,other,0
task_02640,1,high,I want to see some sort of Play movie on Shattuck Cinemas. Can you help?,72,15,1,0,0,5,Movies_1_BuyMovieTickets|Movies_1_FindMovies|Movies_1_GetTimesForMovie|Restaurants_2_ReserveRestaurant|Restaurants_2_FindRestaurants,25,15,21,2,2,0,0,7,1,73.8,622,other,0
task_02641,1,medium,"Hi, I think I need some help. Can you get me the best SF Psychologist please?",77,16,1,0,1,3,Services_4_BookAppointment|Services_4_FindProvider|Weather_1_GetWeather,7,6,7,0,0,0,0,1,1,99.0,232,rl,1
task_02642,1,high,"Could you play a track from the album Borbena by Teodora? Preferably something released in 2019, and let it play in the kitchen, please.",136,23,1,4,0,3,Music_3_PlayMedia|Music_3_LookupMusic|Weather_1_GetWeather,10,2,10,0,0,0,0,3,1,84.4,295,audio,1
task_02643,0,low,What are some gluten-free recipes for dinner?,45,7,1,0,0,1,find_recipes,3,2,2,0,0,1,0,0,0,61.67,81,nlp,1
task_02644,1,low,ช่วยหาคุณแม่บ้านที่ให้บริการรีดผ้า,34,0,0,0,0,1,get_service_id,2,1,0,2,0,0,0,1,1,80.5,80,other,0
task_02645,1,high,"Help find a service provider Cleaning and additional ironing services, Bangkok, March 20, 2024, available space at 6:00 p.m.",124,17,0,9,0,2,get_service_providers|view_service_provider_profile,21,2,3,9,9,0,0,0,1,134.38,138,other,1
task_02646,0,medium,"""Can you help me find a property in San Francisco, CA that is a condo with 2 bedrooms and fits within my budget range of $500,000 to $800,000? After that, could you also provide an estimated value for a villa in Los Angeles, CA with 3 bedrooms that is 5 years old? Lastly, I would also like to know the estimated value of an apartment in New York, NY with 1 bedroom that is 10 years old.""",388,70,2,18,3,2,property_valuation.get|realestate.find_properties,8,8,4,3,0,0,1,0,0,48.12,136,other,1
task_02647,0,low,Who is the Vice President of United States?,43,8,1,0,0,1,us_president_in_year,2,1,1,1,0,0,0,0,0,40.5,64,other,0
task_02648,1,medium,"Add a new service configuration for a service named 'fdsa'. The configuration should have a timeout of 30 seconds, retry count of 5, the endpoint URL 'https://api.fdsa-service.com', and it requires authentication.",213,32,0,3,1,3,add_service_config|ApplicationSettingsApi.get_service_configs|ApplicationSettingsApi.order_service_config,7,3,2,1,2,1,1,1,1,104.29,371,other,1
task_02649,0,medium,"What is the mean of an experiment with 50 successful outcomes out of 500 trials, under the null hypothesis that the probability of success is 0.1?",146,23,1,7,0,1,hypothesis_testing.get_p_value,4,3,1,3,0,0,0,1,1,97.0,71,math,0
task_02650,1,high,"Hi, Find me a Comedy-drama movie that stars Josh Barclay Caras and is directed by Gene Stupnitsky?",98,17,1,0,0,3,Movies_3_FindMovies|Music_3_PlayMedia|Music_3_LookupMusic,11,1,11,0,0,0,0,4,1,69.55,231,audio,1
task_02651,1,high,"I need to add a new PostgreSQL server to our system with the following details: host example.org, port 5432, the database named 'inventory', username 'admin', and password 'secret'.",181,28,0,4,0,7,default_function|add_mtnards_server|add_postgres_server|dartfx_help|list_servers|open_project|close_project,18,10,13,2,3,0,0,2,1,74.5,688,data_query,1
task_02652,0,medium,"Book a single room for two nights at the Hilton Hotel in Chicago, starting from 10th December 2022.",99,17,0,6,0,3,get_stock_price|currency_converter|book_hotel,9,9,6,2,0,1,0,0,0,35.78,266,finance,1
task_02653,0,low,How far will a car travel in time 't' when launched with velocity 'v' at an angle 'theta'?,90,18,1,0,0,1,calculate_projectile_range,3,2,0,3,0,0,0,0,1,61.33,109,math,0
task_02654,1,medium,I need to book an appointment with John's Barber Shop for a haircut on March 15th at 2 in the afternoon,103,20,0,3,0,3,Services_1_BookAppointment|Services_1_FindProvider|Weather_1_GetWeather,7,5,6,0,1,0,0,0,1,82.0,272,rl,1
task_02655,0,medium,"""Can you help me calculate the quarterly dividend per share for my company? We have just paid out a total of $5,000,000 in dividends and currently have 2,000,000 outstanding shares. Also, I am considering a scenario where we might increase our total payout to $6,000,000 while keeping the same number of outstanding shares. What would be the quarterly dividend per share in that case? And what if we also increase our outstanding shares to 2,500,000 while keeping the total payout at $6,000,000?""",496,77,3,35,0,1,finance.calculate_quarterly_dividend_per_share,2,2,0,2,0,0,0,0,0,39.5,103,math,1
task_02656,1,medium,I'm looking for a Theater event in Cape Town for the date 2023-05-06.,69,12,0,8,0,3,Events_3_FindEvents|Events_3_BuyEventTickets|RideSharing_2_GetRide,10,9,8,2,0,0,0,4,1,82.4,276,other,1
task_02657,0,low,What are some recommended exercises for legs?,45,7,1,0,0,1,grocery.get_food_list,3,2,1,1,0,1,0,0,1,43.0,61,other,0
task_02658,1,medium,I need to take a screenshot of the current website shown in Google Chrome. How can i achieve this with Python ?,111,21,1,0,0,1,requests.get,10,1,2,1,2,1,4,0,1,65.6,121,other,0
task_02659,1,medium,I had 8 pieces of frozen mango and a chai tea.  Earlier I had two slices of pepperoni pizza and a coffee,104,21,0,1,0,1,log_food,5,3,4,1,0,0,0,2,1,80.4,67,other,1
task_02660,1,medium,Order 5 fries from uber eats mc donalds,39,7,0,1,0,2,flight.status.check|uber.eat.order,6,6,4,0,0,2,0,1,0,74.67,205,travel,1
task_02661,1,high,turn it by 20 degree and freeze it to 40 degree celsius,55,10,0,4,0,5,flipImageAction|rotateImageAction|removeBackgroundAction|getRecommendationsAction|resizeImageAction,16,6,8,6,2,0,0,5,1,90.81,540,vision,0
task_02662,1,low,Can you provide me with the WHOIS historical data for domain adobe.com on VirusTotal? I'll use the API key adobe_key123.,120,22,1,3,2,1,get_current_weather,2,1,2,0,0,0,0,1,1,116.0,72,travel,0
task_02663,1,low,I want to see community posted comments about slack.com from VirusTotal. Get me the next 30 comments using cursor 'slack_c2'. My key is sl_key456.,146,26,0,6,0,1,get_current_weather,2,1,2,0,0,0,0,1,1,116.0,72,communication,0
task_02664,0,medium,Find a local guitar shop that also offers violin lessons in Nashville.,70,12,0,0,0,2,music_shop.find_nearby|gym.find_nearby,6,2,2,0,0,4,0,0,0,53.17,179,audio,1
task_02665,0,low,Find the favorite restaurant in London.,39,6,0,0,0,1,cell.divide,3,2,2,1,0,0,0,0,0,54.33,56,other,0
task_02666,1,low,Find me a good restaurant.,26,5,0,0,0,1,ChaFod,1,1,1,0,0,0,0,1,0,97.0,134,other,0
task_02667,1,high,"Pick one of the provided functions to fulfill the following command: Change the point 'pointA' to 2,3,4",103,16,0,3,0,4,set_integer|set_string|set_float|set_point,10,10,5,5,0,0,0,0,0,45.2,253,other,1
task_02668,1,high,"Could you assist me in finding a bus itinerary from Fresno, CA to Los Angeles for the 10th of march 2023? I'm planning to travel alone.",135,25,1,6,1,4,Buses_3_FindBus|Buses_3_BuyBusTicket|Hotels_4_ReserveHotel|Hotels_4_SearchHotel,20,12,14,4,2,0,0,5,1,79.85,567,nlp,1
task_02669,1,medium,create a news item in sitefinity with empty content,51,9,0,0,0,1,sitefinity_create_contentitem,5,5,5,0,0,0,0,0,0,133.2,190,other,0
task_02670,1,low,Can you tell me the details of the individual who has the identifier number 4?,78,14,1,1,0,1,fetchPerson,1,1,0,1,0,0,0,0,0,51.0,64,other,1
task_02671,1,high,rotate the image by 30 degrees,30,5,0,2,0,5,flipImageAction|rotateImageAction|removeBackgroundAction|getRecommendationsAction|resizeImageAction,16,6,8,6,2,0,0,5,1,90.81,540,vision,1
task_02672,1,medium,Fetch the annual income statement for APPL in JSON format with a limit of 2 records,83,15,0,1,2,2,uber.eat.order|fmp.income_statement,8,5,5,1,0,2,0,2,1,85.25,297,other,1
task_02673,1,high,Ändere columnCount zu 12,24,3,0,2,0,4,set_integer|set_string|set_float|set_point,10,10,5,5,0,0,0,0,0,45.2,253,other,1
task_02674,0,low,Can I find an Italian restaurant with Gluten-free options near Brooklyn?,72,11,1,0,0,1,find_restaurant,3,3,3,0,0,0,0,0,0,40.0,56,other,1
task_02675,1,high,"Can you locate a service provider in Bangkok who offers both ironing and cleaning services, including bathroom washing, with a good reputation?",143,22,1,0,0,2,get_service_providers|view_service_provider_profile,20,1,4,8,8,0,0,0,1,138.9,229,other,1
task_02676,1,high,write a poem on kite,20,5,0,0,0,3,search_engine.query|generate_image|generate_human_image,13,4,8,3,2,0,0,5,1,76.15,510,vision,0
task_02677,1,high,"Close the data analysis project with the ID 'DA-12345'. Ensure it's archived after closure, but don't send out any notifications to the team.",141,23,0,5,2,7,default_function|add_mtnards_server|add_postgres_server|dartfx_help|list_servers|open_project|close_project,18,10,13,2,3,0,0,2,1,74.5,688,other,1
task_02678,1,low,sum,3,1,0,0,0,1,calculate_sum,2,2,0,2,0,0,0,0,0,59.5,120,math,0
task_02679,0,low,"Calculate the Future Value of an investment of $1000 with an annual interest rate of 5% for 1,5 and 10 years.",109,17,0,9,0,1,financials.calculate_future_value,3,3,0,3,0,0,0,0,0,46.0,78,math,1
task_02680,0,low,What's the elevation and area of Yellowstone National Park?,59,9,1,0,0,1,park_information,2,2,1,0,0,1,0,0,0,39.0,77,other,1
task_02681,1,low,I've completed the task 'Submit monthly financial report'. Mark it as completed on my to-do list?,97,16,1,0,0,1,todo,2,2,2,0,0,0,0,1,0,110.5,84,other,1
task_02682,1,high,I have some free time and I'd like to watch a movie. Can you find me a movie with Katsunosuke Hori in the cast?,111,24,1,0,0,3,Events_3_FindEvents|Events_3_BuyEventTickets|Movies_3_FindMovies,10,6,9,1,0,0,0,2,1,99.1,273,other,1
task_02683,1,low,Help find a housekeeper who provides ironing services.,54,8,0,0,0,1,get_service_id,2,2,0,2,0,0,0,2,0,140.0,78,other,0
task_02684,1,medium,create a new postgres server http://plgah.ca. Username is pascal,64,11,0,0,0,2,get_current_weather|add_postgres_server,7,4,6,1,0,0,0,1,1,76.57,193,travel,0
task_02685,0,low,Who is the laywer for the Doe vs. Smith law case?,49,11,1,0,0,1,case_review.retrieve_case_outcome,3,2,2,1,0,0,0,0,1,39.33,44,data_query,0
task_02686,0,medium,What is the equivalent note of C in Indian musical scale? And convert the frequency 440 Hz to wavelength?,105,18,2,3,0,2,frequency_to_wavelength|note_conversion.indian,2,2,1,1,0,0,0,0,0,38.5,118,audio,1
task_02687,1,high,"I'm interested in hearing some Funk music from the Isolation album, Find a selection of tracks for me?",102,18,1,0,0,3,Music_3_PlayMedia|Music_3_LookupMusic|Weather_1_GetWeather,10,2,10,0,0,0,0,3,1,84.4,295,audio,1
task_02688,1,low,I have a string 'hello=good=' and I need to split it at each '=' to get a list containing only 'hello' and 'good='. How can I achieve this?,139,28,1,0,0,0,,0,0,0,0,0,0,0,0,0,,0,other,0
task_02689,1,medium,When do I go on my next trip?,29,8,1,0,0,2,EventQuery|reschedule_event,6,3,5,0,1,0,0,0,1,75.33,251,scheduling,0
task_02690,1,medium,Provide me with all the actively configured websites.,53,8,0,0,0,3,get_websites|website_configuration_api.WebsiteConfigurationApi.get_website|ApplicationSettingsApi.get_service_configs,5,1,3,0,2,0,0,1,1,105.4,281,other,1
task_02691,1,low,Give me some random beats,25,5,0,0,0,1,detect_beats_and_filter,2,2,0,2,0,0,0,0,0,125.5,208,other,0
task_02692,1,high,okay then what can u do,23,6,0,0,0,7,detail_project|detail_experience_and_education|list_projects|experiences_and_education|contact|get_tech_stack|help.display,20,7,13,1,6,0,0,3,1,81.45,689,other,0
task_02693,1,medium,drink,5,1,0,0,0,2,ChaFod|ChaDri.change_drink,6,3,5,0,0,0,1,0,1,68.33,269,other,0
task_02694,1,medium,What's the area of a square with a side of size 5 cm and what is the weather in Queenstown Singapore?,101,20,1,1,0,2,get_current_weather|get_area_of_square,3,2,2,1,0,0,0,1,1,86.0,169,travel,1
task_02695,1,high,"Hi, are there any free performance venue I can visit in London?",63,12,1,0,0,5,Flights_4_SearchOnewayFlight|Flights_4_SearchRoundtripFlights|Hotels_2_BookHouse|Hotels_2_SearchHouse|Travel_1_FindAttractions,25,11,21,4,0,0,0,9,1,84.6,602,travel,1
task_02696,1,medium,"I need a 'Plus' Uber from 2020 Addison Street, Berkeley, CA, and I can wait up to 10 minutes for it.",100,19,0,6,1,2,uber.eat.order|uber.ride,6,5,3,1,0,2,0,1,1,89.0,199,other,1
task_02697,1,high,"I'm looking for someone who can iron clothes in the Bang Khen District of Bangkok. Find someone with a good reputation, say with an average rating of at least 4 stars?",167,30,1,1,0,2,get_service_providers|view_service_provider_profile,21,1,4,8,9,0,0,3,1,99.19,220,other,1
task_02698,0,medium,"""What is the capital city of Australia, what is the current population of Canada, and what is the largest city in Brazil?""",122,22,1,0,0,3,country_info.largest_city|country_info.population|country_info.capital,3,3,3,0,0,0,0,0,0,20.0,144,other,1
task_02699,0,high,"""Could you please help me with the following tasks? First, I would like to know the top 5 defence ranking NBA teams from the 2018 season. Second, I have a list of numbers [23, 45, 12, 89, 34, 67, 29] that I need to be sorted in descending order. Lastly, I am curious about the Compound Annual Growth Rate (CAGR) of an investment I made. The initial investment value was $5000, the final investment value turned out to be $15000, and the period of the investment was 7 years. Could you calculate this for me?""",508,83,2,29,2,3,calculate_cagr|get_defense_ranking|array_sort,7,6,1,5,0,1,0,1,1,40.43,250,math,1
